Case Number,Date,Year,Type,Country,Area,Location,Activity,Sex,Age,Injury,Fatal (Y/N),Time,Species,Investigator or Source
2005.04.25,25-Apr-05,2005,Provoked,AUSTRALIA,New South Wales,Bermagui,Fishing,M,25,Laceration on left thigh PROVOKED INCIDENT,N,23h00,"Mako shark, 1.5 m [5'] ","Brisbane Courier Mail, 4/26/2005"
2005.04.17.R,17-Apr-05,2005,Unprovoked,AUSTRALIA,New South Wales,Crookhaven,,,,Shark-bitten surfboard found adrift,N,,,"Illawarra Mercury, 4/17/2005"
2005.04.16.a,16-Apr-05,2005,Unprovoked,AUSTRALIA,New South Wales,Bronte Beach,Surfing,M,40,"No injury, board bitten",N,06h10,Bronze whaler shark,The Sun; Illwarra Mercury; Yahoo News
2005.04.13,13-Apr-05,2005,Unprovoked,USA,Florida,"Crescent Beach, Sarasota County",Wading,F,70,Right lower leg bitten,N,,1.8 m [6'] blacktip shark,Herald Tribune.com
2005.04.09,09-Apr-05,2005,Invalid,USA,Florida,"Central Gulf Coast, St. John County",Surfing,M,52,Foot injured ,N,,Shark involvement not confirmed,"WTSP TampaBays10.com; First Coast News, April 10, 2005 "
2005.04.06,06-Apr-05,2005,Unprovoked,USA,Florida,"Jacksonville Beach, Duval County",,F,,Left calf injured,N,,small hammerhead shark,WJXT News4Jax.com
2005.03.28,28-Mar-05,2005,Unprovoked,SOUTH AFRICA,Western Cape Province,Noordhoek,Surfing,M,32,"Lacerations to right calf, puncture wounds on right foot",N,09h45,4 m [13'] shark,"ITN, 3/30/2005"
2005.03.27.R,Reported    27-Mar-2005,2005,Unprovoked,AUSTRALIA,New South Wales,,Surfing,M,,"No injury, shark rammed surfboard",N,,,"Sunday Age, 3/27/2005"
2005.03.19,19-Mar-05,2005,Unprovoked,AUSTRALIA,Western Australia,"Wreck Point, Abrolhos Islands",Snorkeling,M,26,FATAL,Y,14h00,6 m [20'] white shark,"T. Peake, GSAF"
2005.03.10,10-Mar-05,2005,Invalid,SOUTH AFRICA,KwaZulu-Natal,Isipingo,,M,51,Shark bites post mortem,N,,"Tiger shark, 2.5 m [8.25']","J. Govander, Nokia Sea Rescue, SAPA"
2005.02.26,26-Feb-05,2005,Unprovoked,AUSTRALIA,Queensland,Brisbane River,Swimming,M,18,Finger bitten,N,,Bull shark,Queensland Times
2005.02.22,22-Feb-05,2005,Provoked,USA,Florida,"Long Key, Monroe County",Spearfishing,M,,Speared shark bit his chest PROVOKED INCIDENT,N,,"Nurse shark, 3' ",http://www.foldabikes.com/CurrentEvents/Story/Florida.html
2005.02.16,16-Feb-05,2005,Unprovoked,USA,Hawaii,"Rocky Point, north shore of O'ahu",Surfing,M,,"No injury, knocked off board, shark bit board",N,14h30,"Tiger shark, 2.4 m [8']"," R. Collier, GSAF;  T. Winters, Honolulu Advertiser, 2/17/2005 "
2005.02.13,13-Feb-05,2005,Unprovoked,USA,Florida,Fort Lauderdale,Spearfishing,M,,Hand bitten,N,,1.8 m [6'] Caribbean reef shark,J. Herrera
2004.12.16,16-Dec-04,2004,Unprovoked,AUSTRALIA,South Australia,"West Beach, Adelaide",Scurfing (surfboard being  towed behind a boat),M,18,FATAL,Y,15h15,4.5 m & 5 m white shark ,"P. Kemp & T. Peake, GSAF"
2004.12.11,11-Dec-04,2004,Unprovoked,AUSTRALIA,Queensland,Opal Reef,Spearfishing,M,38,"FATAL, leg bitten",Y,13h00,Bull shark,"Weekend Australian, 2/17/2005, et al."
2004.11.27,27-Nov-04,2004,Unprovoked,SOUTH AFRICA,Eastern Cape Province,"Nahoon, East London",Surfing,M,20,3 lacerations on foot,N,18h00,Raggedtooth shark,J. Eager
2004.11.26,26-Nov-04,2004,Unprovoked,SOUTH AFRICA,Eastern Cape Province,Gonubie,Playing,M,16,Lacerations on lower leg & foot,N,,Raggedtooth shark,J. Eager
2004.11.15,15-Nov-04,2004,Unprovoked,SOUTH AFRICA,Western Cape Province,"Fish Hoek, False Bay",Swimming,F,77,FATAL,Y,07h00,6 m [20'] white shark,"J.P. Botha, GSAF"
2004.11.11.b,11-Nov-04,2004,Unprovoked,USA,California,"Bunkers, Humboldt Bay, Eureka, Humboldt County",Surfing,lli,38,"Lacerations to hand, knee & thigh ",N,13h30,5.5 m [18'] white shark,"R. Collier, GSAF                "
2004.10.30.a,30-Oct-04,2004,Unprovoked,SOUTH AFRICA,Western Cape Province,Gansbaai,Chumming for white sharks,M,52,Right ankle & foot lacerated,N,Morning,2 m [6.75'] white shark,"J.P. Botha, GSAF"
2004.10.21,21-Oct-04,2004,Unprovoked,AUSTRALIA,New South Wales,Stockton Beach,Surfing,M,59,Right foot lacerated,N,Afternoon,"Bronze whaler shark, 2.4 m [8'] ","The Border Mail, 10/23/2004"
2004.10.10,10-Oct-04,2004,Unprovoked,USA,California,"Limantour Beach, Point Reyes National Seashore",Surfing,M,,Lower leg bitten,N,09h30,1.8 m to 2.4 m [6' to 8'] white shark,"R. Collier, GSAF"
2004.10.09.b,09-Oct-04,2004,Unprovoked,USA,Hawaii,Moloka'i,Spearfishing,M,34,Left shoulder bitten,N,12h40,"Tiger shark, 2.4 m to 3.7 m [8' to 12'] ","The Maui News, 10/10/2004 "
2004.10.09.a,09-Oct-04,2004,Unprovoked,SOUTH AFRICA,Eastern Cape Province,Jeffrey�s Bay,Surfing,M,34,Puncture wounds on right foot,N,Morning,"Raggedtooth shark, 1.5 to 2 m [5' to 6.75']","Sunday Argus, 10/10/2004; W. Steenkamp, Cape Times 10/9/2004"
2004.10.02,02-Oct-04,2004,Unprovoked,USA,California,"Pismo Beach, San Luis Obispo County",Surfing,M,16,"No injury, knocked off surfboard",N,15h30,,"R. Collier, GSAF"
2004.10.01,01-Oct-04,2004,Unprovoked,USA,California,"Lifeguard Tower 16, Huntington Beach, Orange County",Surfing,M,40,"No injury, shark struck board & spun it around",N,14h00,,"R. Collier, GSAF"
2004.09.25,25-Sep-04,2004,Boat,AUSTRALIA,Queensland,Batt Reef,Spearfishing/ filming,,,"No injury to occupants, boat damaged",N,12h00,"Tiger shark, 3 m [10'] ","R. Collier, GSAF"
2004.08.29,29-Aug-04,2004,Unprovoked,USA,Florida,"New Smyrna Beach / Cape Canaveral  National Seashore, Brevard County",Walking,F,38,Heel bitten,N,17h30,,"T. Jerome, GSAF; Daytona Beach News Journal, 8/31/2004"
2004.08.20,20-Aug-04,2004,Unprovoked,USA,California,"204s, San Clemente, Orange County",Surfing,M,,Foot bitten,N,17h30,0.9 m to 1.2 m [3' to 4'] white shark,"R. Collier, GSAF"
2004.08.15,15-Aug-04,2004,Unprovoked,USA,California,"Kibesillah, Mendocino County",Diving,M,50,FATAL,Y,16h00,4.9 m to 5.5 m [16' to 18'] white shark,"R. Collier & L. Levine, GSAF"
2004.08.06,06-Aug-04,2004,Unprovoked,USA,Florida,"Big Bayou, St. Petersburg, Pinellas County ",Swimming,M,47,"Back, buttocks, left hand & left side of face bitten",N,20h30,1.2 m [4'] shark,"T. Jerome, GSAF"
2004.08.03,03-Aug-04,2004,Unprovoked,AUSTRALIA,New South Wales,Byron Bay,Spearfishing,M,30,Minor puncture wounds to leg,N,14h00,,"T. Peake, GSAF"
2004.08.00,Aug-04,2004,Boat,SOUTH AFRICA,KwaZulu-Natal,Park Rynie,Fishing,,,No injury to occupants; boat damaged,N,,3 m to 4 m [10' to 13']  white shark,"J. Eager, scubaradio.com"
2004.07.31,31-Jul-04,2004,Unprovoked,USA,Florida,"Cocoa  Beach, Brevard County",Surfing,F,20,Right foot bitten,N,13h00,,"C. Creswell, GSAF"
2004.07.19.R," 19-Jul-2004 Reported to have happened  ""on the weekend""",2004,Boat,AUSTRALIA,Western Australia,"7 km off Trigg surf beach, Perth",Fishing,,,"No injury to occupants; shark mouthed motor, severed anchor line",N,,4 m [13'] white shark,"Channel 9; Northern Territory News, 7/20/2004, p.10 "
2004.07.10,10-Jul-04,2004,Unprovoked,AUSTRALIA,Western Australia,"Lefthanders Beach, Margaret River",Surfing,M,30,"FATAL, abdomen, pelvis & leg bitten      ",Y,14h10,"2 sharks, 4.5 m & 3 m ","T. Peake, GSAF"
2004.06.26.b,26-Jun-04,2004,Unprovoked,USA,California,"San Onofre State Beach, San Diego County",Surfing,M,45,"No injury, shark struck his board",N,09h00,"9'2"" white shark",R. Collier; GSAF
2004.06.26.a,26-Jun-04,2004,Invalid,AUSTRALIA,Western Australia,Floreat Beach,Crayfishing,M,,"No injury, shark made threat displays & diver fended it off with his speargun",N,,,"T. Peake, GSAF; Sunday Times (Perth)  6/27/2004, p.11"
2004.06.14,14-Jun-04,2004,Unprovoked,USA,Florida,"Disney / Vero Beach, Indian River County",In water with diving seabirds,F,,Foot bitten,N,,,Global Lifeguards
2004.06.10.b,10-Jun-04,2004,Unprovoked,AUSTRALIA,Western Australia,Bunbury,Body boarding,M,17,Ankle & foot lacerated,N,Late afternoon,"Bronze whaler shark, 2.5 m [8.25'] ","T. Peake, GSAF"
2004.06.10.a,10-Jun-04,2004,Unprovoked,USA,Florida,"Daytona Beach Shores, Volusia County",Swimming,M,8,Right wrist  & left arm lacerated,N,18h00,1.2 m [4'] shark,"T. Jerome, GSAF; Daytona Beach News Journal,, 6/11/2004, p.1C"
2004.06.02,02-Jun-04,2004,Unprovoked,SOUTH AFRICA,Western Cape Province,Dyer Island,"Swimming, poaching perlemoen",M,21,"FATAL, leg severed ",Y,15h00,White shark,"J. Smetherham & B. Ndenze, Cape Times"
2004.05.28,28-May-04,2004,Unprovoked,USA,California,"Salmon Creek, Sonoma County",Surfing,M,44,No injury,N,11h00,2.4 m to 3.7 m [8' to 12'] shark,"R. Collier, GSAF; B. Connor, Jr."
2004.05.23.a,23-May-04,2004,Unprovoked,USA,Florida,"St. Augustine, St. John's County",Boogie-boarding / swimming,M,9,Calf & foot lacerated,N,12h30,,News4Jax
2004.05.22.c,22-May-04,2004,Invalid,USA,Florida,St. Augustine  St. Johns County,Swimming,M,9,Single puncture wound on the foot,N,,Shark involvement not confirmed,"T. Jerome, GSAF"
2004.05.22.b,22-May-04,2004,Unprovoked,USA,Florida,"Jacksonville Beach, Duval County",,F,9,Foot bitten,N,Afternoon,,First Coast News
2004.04.26,26-Apr-04,2004,Unprovoked,AUSTRALIA,New South Wales,"Latitude Reef, near Forster",Diving,M,,Puncture wounds on wrist,N,Morning,"Wobbegong shark, 1.2 m [4'] k","T. Peake, GSAF"
2004.04.07,07-Apr-04,2004,Unprovoked,USA,Hawaii,"Kahana Beach, Maui",Surfing,M,57,FATAL Severe wound to right thigh & calf,Y,07h08,Tiger shark,"L. Fujimoto, B. Perry & M. Tanji, Maui News "
2004.04.05,05-Apr-04,2004,Unprovoked,SOUTH AFRICA,Western Cape Province,"Surfers' Corner, Muizenberg, False Bay",Surfing,M,16,"Left leg lacerated, right leg severed above the knee ",N,14h00,5 m [16.5'] white shark,"L. Compagno & E. Ritter, GSAF"
2004.04.04,04-Apr-04,2004,Invalid,USA,Hawaii,Velzyland,Surfing,F,22,"Disappeared, surfboard washed ashore, marks on leash suggested shark involvement ",Y,,,"R. Antone, Honolulu Star Bulletin"
2004.03.31.b,31-Mar-04,2004,Unprovoked,USA,Florida,"Ocean Reef Park, Singer Island, Palm Beach County",,M,26,Right foot bitten,N,,,"D. Davies, Palm Beach Post, 6/3/2004"
2004.03.31.a,31-Mar-04,2004,Unprovoked,USA,Florida,"Stuart Rocks, Martin County",Surfing,M,20,15 puncture wounds on foot,N,09h00,1.2 m [4'] bull shark,"T. Jerome, GSAF; Palm Beach Post,  4/1/2004"
2004.03.28,28-Mar-04,2004,Unprovoked,USA,Florida,"Pelican Beach Park, Satellite Beach, Brevard County",Surfing,M,,Heel bitten,N,15h00,bull shark,"J.D. Gallop, Florida Today"
2004.03.27.a,27-Mar-04,2004,Unprovoked,USA,Florida,"Sanibel Island, Lee County",Swimming,M,61,Minor lacerations & abrasions on forearm,N,08h30,,"T. Jerome, GSAF"
2004.03.24,14-Mar-04,2004,Unprovoked,USA,Hawaii,Punaluu,Snorkeling,F,,Lacerations to left foot,N,10h00,1.8 m [6'] shark,Hawaii Department of Land and Natural Resources
2004.03.16,16-Mar-04,2004,Unprovoked,USA,Hawaii,"Kalihiwai Beach, Kauai",Surfing,M,51,"No injury, board bitten",N,07h45,"Tiger shark, 2.4 m to 3 m [8' to 10'] ",The Hawaii Channel
2004.03.06,06-Mar-04,2004,Unprovoked,AUSTRALIA,Western Australia,5 nm off Cervantes,Spearfishing,M,47,Shin & calf bitten,N,,"Bronze whaler shark, 1.5 m [5'] ","T. Peake, GSAF; Sunday Times (Perth) 3/7/2004, p.19"
2004.02.21,21-Feb-04,2004,Unprovoked,AUSTRALIA,New South Wales,"Taree, Old Bar Beach",Swimming,M,,Three toes lacerated,N,,,Manning River Times
2004.02.16,16-Feb-04,2004,Invalid,AUSTRALIA,Queensland,"Fido's Reef, 300 m east of Cook Island. Cook Island is 2 miles from Tweed Heads, Gold Coast",Free diving & spearfishing,M,31,"Disappeared while diving, may have suffered shallow water blackout. Searchers observed large tiger sharks & whaler sharks in the area",N,11h00,Shark involvement not confirmed,"news.com.au; Northern Territory News, 2/18/2004, p.10; Sunday Territorian, 2/22/2004, p.9; "
2004.02.11,11-Feb-04,2004,Unprovoked,AUSTRALIA,New South Wales,Caves Beach,Snorkeling,M,22,Leg bitten,N,,"60 cm [23.6""] blind or brown shark","T. Peake, GSAF"
2004.01.25,25-Jan-04,2004,Unprovoked,AUSTRALIA,Western Australia,Binningup,Scuba diving,M,46,Left leg bitten,N,11h05,4 m to 5 m [13' to 16.5'] white shark,"T. Peake, GSAF"
2004.01.15.R,Reported 15-Jan-2004 ,2004,Boat,SOUTH AFRICA,KwaZulu-Natal,Ballito,Surf skiing,M,,"No injury to occupants, stern of ski bitten",N,,"Mako shark, 3 m to 4 m [10' to 13'] ",surfski.co.nz
2004.01.12,12-Jan-04,2004,Unprovoked,AUSTRALIA,New South Wales,Bushrangers Pass at Bass Point,Diving,M,,"No injury, swim fin ripped off",N,Midday,"Raggedtooth shark, 3.5 m [11.5'] ","T. Peake, GSAF"
2004.01.07,07-Jan-04,2004,Unprovoked,SOUTH AFRICA,Eastern Cape Province,"West Beach, Port Alfred",Surfing,M,22,Foot lacerated,N,,Raggedtooth shark,"A. Cobb & E. Ritter, GSAF"
2004.00.00,2004,2004,Unprovoked,AUSTRALIA,Western Australia,Redgate Beach,Surfing,M,,No inury,N,Morning,,J. Carlsen
2003.12.31,31-Dec-03,2003,Boat,SOUTH AFRICA,KwaZulu-Natal,Salt Rock ,,,,No injury to occupants,N,,Shortfin mako shark,Natal Sharks Board
2003.12.26,26-Dec-03,2003,Invalid,USA,Florida,"Miami, Dade County",Swimming,M,28,Knee lacerated,N,,Questionable Incident,"The Times (London), 12/27/2003, p.4"
2003.12.13.b,13-Dec-03,2003,Unprovoked,USA,Florida,"Melbourne Beach, Brevard County",Swimming,M,13,Foot bitten,N,13h15,,"Florida Today (Melbourne), 12/14/2003"
2003.11.30.b,30-Nov-03,2003,Unprovoked,AUSTRALIA,Western Australia,Perth? (Margaret River District),Swimming,M,,"After biting Halverson, it bit Scott's thigh",N,11h30,"Wobbegong shark, 1.2 m [4'] ","J. Eager, scubaradio.com"
2003.11.30.a,30-Nov-03,2003,Unprovoked,AUSTRALIA,Western Australia,Perth? (Margaret River District),Swimming,M,,Hand & foot bitten,N,11h30,"Wobbegong shark, 1.2 m [4'] ","J. Eager, scubaradio.com"
2003.11.27,27-Nov-03,2003,Unprovoked,SOUTH AFRICA,KwaZulu-Natal,Sodwana,Spearfishing,M,21,"Presumed FATAL, severed hand recovered",Y,>08h00,"Tiger shark, 4 m [13']  ?","E. Ritter, GSAF"
2003.11.22,22-Nov-03,2003,Unprovoked,USA,Florida,"Daytona Beach, Volusia County",Surfing,F,35,Severe abrasion to left lateral calf,N,15h30,4' shark,T. Trumbauer
2003.11.12.a,12-Nov-03,2003,Unprovoked,USA,Florida,"South Jetty, New Smyrna Beach, Volusia County",Surfing,M,24,Lacerations to hand,N,,,"S. Petersohn, GSAF"
2003.11.06.a,06-Nov-03,2003,Unprovoked,SOUTH AFRICA,KwaZulu-Natal,Karridene,Surf skiing,,,"No injury to occupants, hull of ski bitten",N,,White shark,Natal Sharks Board
2003.11.01,01-Nov-03,2003,Unprovoked,AUSTRALIA,New South Wales,"Seal Rocks, north of Newcastle",Standing,M,,Minor lacerations to leg & foot,N,Dusk,,"The Sun; 11/2/2003, p.9"
2003.10.31.c,31-Oct-03,2003,Unprovoked,USA,Florida,"Ponte Vedra Beach, St. Johns County",Surfing,M,18,Left foot (sole) bitten,N,15h00,1.2 m to 1.5 m [4' to 5'] shark,"D. Dixon, Florida Times-Union, 11/8/2003 "
2003.10.31.b,31-Oct-03,2003,Unprovoked,AUSTRALIA,New South Wales,"Lighthouse Beach, Seal Rocks",Surfing,M,22,Left ankle & foot lacerated,N,17h30,"1.5 m [5'] shark, either a bronze whaler or a grey nurse shark",ABC News Australia
2003.10.31.a,31-Oct-03,2003,Unprovoked,USA,Hawaii,"Tunnels surf break off Makua Beach, Kaua'i",Surfing,F,13,Left arm severed below shoulder,N,07h30,"Tiger shark, 14' "," E. Ritter, GSAF  "
2003.10.27,27-Oct-03,2003,Unprovoked,USA,Florida,"New Smyrna Beach, Volusia County",Surfing,M,46,Laceration on right ankle & heel,N,12h20,,"S. Petersohn, GSAF"
2003.10.24,24-Oct-03,2003,Invalid,USA,Hawaii,Honolua Bay,Snorkeling,M,56,Left forearm lacerated,N,12h20,Shark involvement not confirmed,"Timothy Hurley, Advertiser Maui County Bureau"
2003.10.14,14-Oct-03,2003,Unprovoked,USA,Florida,Near Patrick Air Force Base Brevard County,Surfing,M,19,Foot bitten,N,--,1.2 m [4'] shark,WFTV.com
2003.10.06,06-Oct-03,2003,Invalid,USA,Florida,Palm Beach?,Swimming to shore from boat or kayak,M,,"Fatal, drowning or scavenging.  Two hours later his body, with bite marks,  washed ashore.",Y,--,,"E. Pace, FSAF"
2003.10.05.e,05-Oct-03,2003,Unprovoked,USA,Florida,"Ocean Reef Park, Singer Island, Palm Beach County",Surfing,F,,Minor puncture wounds in hand,N,15h00,,"J. Eager, scubaradio.com"
2003.10.05.d,05-Oct-03,2003,Unprovoked,USA,Florida,"Stuart Park Beach, Martin County",Surfing,M,18,5 to 6 lacerations on right foot & ankle,N,14h30,,"Vero Beach Press Journal (FL) 10/6/2003;  Stuart News, 10/6/2003"
2003.10.05.c,05-Oct-03,2003,Provoked,USA,Florida,"South Jetty, New Smyrna Beach, Volusia County",Surfing,M,30,Left ankle bitten when he stepped on the shark PROVOKED INCIDENT,N,14h00,,"S. Petersohn, GSAF"
2003.10.05.b,05-Oct-03,2003,Unprovoked,USA,Florida,"Crawford Road beach approach at New Smyrna Beach, Volusia County",Sitting on surfboard,M,50,Left foot bitten,N,12h02,,"S. Petersohn, GSAF; J. Eager, scubaradio.com"
2003.10.05.a,05-Oct-03,2003,Unprovoked,USA,Hawaii,"Cove Beach / Kalama Beach, Kihei, Maui",Wading near a fishing net,F,41,"Left thigh abraded, right knee and right index finger injured",N,12h55,"1.2 m [4'] ""grey-colored shark""","G. Kubota, Star Bulletin"
2003.09.28,28-Sep-03,2003,Unprovoked,USA,Florida,"North Hutchinson Island, St. Lucie Couny",Surfing,M,16,Arm lacerated,N,07h45,,"7News Online;  Vero Beach Press Journal, Fort Pierce Tribune, Stuart News, 10/1/2003"
2003.09.21,21-Sep-03,2003,Unprovoked,USA,Florida,"Ponce Inlet, New Smyrna Beach, Volusia County",Surfing,M,21,Left foot bitten,N,11h45,,"S. Petersohn, GSAF; Daytona Beach News Journal, 9/22/2003, p.1C"
2003.09.19,19-Sep-03,2003,Unprovoked,USA,Florida,"Ponce Inlet, New Smyrna Beach, Volusia County",Surfing,M,19,Left heel lacerated,N,16h30,,"S. Petersohn, GSAF"
2003.09.17,17-Sep-03,2003,Unprovoked,USA,Florida,"New Smyrna Beach, Volusia County",Surfing,M,17,3 puncture wounds on left foot,N,14h00,,"S. Petersohn, GSAF"
2003.09.14.c,14-Sep-03,2003,Unprovoked,USA,Florida,"New Smyrna Beach, Volusia County",Surfing,M,30,Left foot: lacerations on heel and sole,N,16h14,3' shark,"S. Petersohn, GSAF"
2003.09.14.b,14-Sep-03,2003,Boat,SOUTH AFRICA,Western Cape Province,Melkbosstrand,Fishing ,,36 & 26,"No injury to occupants, shark bit boat",N,09h40,2 m cow shark,"E. Ritter, GSAF "
2003.09.14.a,14-Sep-03,2003,Invalid,USA,Florida,"Bathtub Reef Beach, Martin County",Swimming,F,8 or 10,Puncture wounds on inner thigh,N,13h30,Shark involvement doubtful,"Fort Pierce Tribune, 9/15/2003"
2003.09.13.b,13-Sep-03,2003,Unprovoked,USA,Florida,"Daytona Beach, Volusia County ",Body boarding,M,18,Left calf avulsion,N,17h11,6' shark,"S. Petersohn, GSAF; News Journal Online; Orlando Sentinel, 9/15/2003, p.B2; R. Weiss, Daytona Beach News Journal, 9/15/2001, p.3C"
2003.09.13.a,13-Sep-03,2003,Unprovoked,USA,South Carolina,"Isle of Palms, Charleston County","Standing, stepped on shark",M,15,Ankle lacerated,N,Afternoon,7' shark,"P. Caston, Post & Courier"
2003.09.12,12-Sep-03,2003,Unprovoked,SOUTH AFRICA,Western Cape Province,Near the wreck of the Kakapo off Noordhoek Beach,Body boarding,M,19,"FATAL, left thigh, buttocks, back of spine, abdomen & chest bitten  ",Y,14h30,White shark,"E. Ritter, GSAF;      http://www.wavescape.co.za/top_bar/locals_only9.htm                               "
2003.09.00,Sep-03,2003,Unprovoked,USA,Florida,"Boca Grande, Lee County",Wade-fishing,M,,2 lacerations on each side of Achilles tendon,N,,,"B. Stout, News-Press, 9/24/2003"
2003.08.19,19-Aug-03,2003,Unprovoked,USA,California,"Avila Beach, San Luis Obispo County","Swimming, wearing black wetsuit & swim fins",F,50,"FATAL          Hip & upper thigh bitten, femoral artery severed ",Y,08h15,4.5 m to 5.5 m [15' to 18'] white shark,"R. Collier, GSAF                "
2003.08.12,12-Aug-03,2003,Invalid,USA,California,"Venice Beach, Los Angeles County",Swimming,M,31,Left ankle lacerated,N,00h30,Shark involvement not confirmed,ABC News
2003.08.08,08-Aug-03,2003,Unprovoked,SOUTH AFRICA,Eastern Cape Province,Jeffrey�s Bay,Sitting on surfboard,M,16,"No injury, wetsuit torn & board bitten",N,08h00,3.5 m [11.5'] white shark,"E. Ritter, GSAF  http://sport.iafrica.com/news/261271.htm       "
2003.07.20,20-Jul-03,2003,Unprovoked,USA,Florida,"Ponce Inlet, New Smyrna Beach, Volusia County",Surfing,M,18,Laceration to little finger of  right hand,N,15h45,,"S. Petersohn, GSAF"
2003.07.15,15-Jul-03,2003,Unprovoked,USA,Florida,"Daytona Beach, Volusia County",Wading,F,15,Heel & sole of left foot,N,14h37,,"S. Petersohn, GSAF"
2003.07.05.b,05-Jul-03,2003,Provoked,USA,Florida,"Near New Smyrna Jetty, Volusia County","Walking, carrying surfboard & stepped on shark",M,10,3 puncture wounds on right lateral ankle PROVOKED INCIDENT,N,10h07,2' shark,"S. Petersohn, GSAF"
2003.07.05.a,05-Jul-03,2003,Unprovoked,USA,Florida,"Canova Beach, Brevard County",Surfing,M,21,Left foot bitten,N,,1.5 m to 1.8 m [5' to 6'] shark,Vero Beach Press Journal (FL) 7/9/2003
2003.07.00.c,Jul-03,2003,Unprovoked,USA,Florida,"Fort Lauderdale, Broward County",Spearfishing,M,,Laceration to toe,N,,8' great hammerhead shark,M. Marks
2003.06.30,30-Jun-03,2003,Unprovoked,USA,Florida,"New Smyrna Beach, Volusia County",Surfing,M,17,Right foot & toes lacerated,N,13h53,Unidentified species,"S. Petersohn, GSAF"
2003.06.26,26-Jun-03,2003,Unprovoked,USA,Florida,St Augustine Beach. St. Johns County,Surfing,M,15,Ankle lacerated,N,Morning,106 cm [3.5']  shark,Local6.com
2003.06.24.b,24-Jun-03,2003,Unprovoked,USA,Florida,"Cocoa Beach, Brevard County",Standing,F,12,2 lacerations to the thigh,N,Afternoon,�small brown shark�,"Florida Today, 6/26/ 2003; WKMG Local 6"
2003.06.24.a,24-Jun-03,2003,Unprovoked,USA,Hawaii,"Makua Beach, Oahu",Swimming with pod of dolphins,M,60,Right foot bitten,N,08h00,3.7 m to 4.3 m [12' to 14'] shark,Honolulu Advertiser
2003.06.08,08-Jun-03,2003,Unprovoked,USA,Florida,"Ponce Inlet, Volusia County",Surfing,,15,6 puncture wounds to left ankle,N,11h55,,"S. Petersohn, GSAF"
2003.06.00,Jun-03,2003,Invalid,USA,South Carolina,"Pawleys Island, Georgetown County",Swimming,F,22,Foot lacerated,N,,Shark involvement not confirmed,J. Eager
2003.05.25,25-May-03,2003,Unprovoked,USA,Florida,"Coral Cove Park, Jupiter Inlet, Palm Beach County",Surfing,M,18,Left foot lacerated,N,10h00,,Local 6 News
2003.05.14,14-May-03,2003,Unprovoked,USA,Florida,"Ponce de Leon Inlet, Volusia County ",Wading,M,22,Left foot bitten,N,13h23,3' to 5' shark,"S. Petersohn, GSAF; Orlando Sentinel, 5/16;2003, p.C3"
2003.05.10,10-May-03,2003,Unprovoked,USA,Hawaii,Between Magic Sands Beach and Kahaluu Beach on the Kona coast,Swimming,M,20,Right calf & heel bitten,N,11h45,1.8 m [6'] reef shark - or a 2.1 m to 2.4 m [7' to 8'] grey-colored shark,WestHawaiiToday.com
2003.05.07,07-May-03,2003,Provoked,USA,Florida,"New Smyrna Beach, Volusia County",Surfing,M,34,Multiple bites to foot after jumping off surfboard onto shark PROVOKED INCIDENT,N,11h40,4' to 5' shark,"S. Petersohn, GSAF; M. I. Johnson,  Daytona Beach News Journal. 5/8/2003, p.1C; Tampa Tribune, 5/8/2003"
2003.05.03,03-May-03,2003,Unprovoked,USA,Florida,"Daytona Beach Shores, Volusia County",Walking,F,9,Laceration to right lower leg,N,12h20,,"S. Petersohn, GSAF"
2003.04.21.b,21-Apr-03,2003,Unprovoked,USA,Florida,"Melbourne Beach, Brevard County ",Surfing,M,36,Right leg bitten,N,14h30,Unidentified species,"Local 6 News; St. Petersburg Times, 4/22/2003; The Eagle, 4/24/2003 "
2003.04.21.a,21-Apr-03,2003,Unprovoked,USA,Florida,"Shepard Park, Cocoa Beach, Brevard County ",Surfing,M,17,Survived,N,13h30,Unidentified species,"Orlando Sentinel, 4/22/2003, B3"
2003.04.20.c,20-Apr-03,2003,Unprovoked,USA,Florida,"Playalinda Beach, Brevard County",Surfing,M,30,Left foot bitten,N,Afternoon,Unidentified species,"Orlando Sentinel, 4/22/2003, B3
  "
2003.04.20.b,20-Apr-03,2003,Unprovoked,USA,Florida,"Sunglow Pier, Daytona Beach Shores, Volusia County",Surfing,M,23,Small lacerations to foot,N,09h00,0.9 m to 1.2 m [3' to 4'] shark,"S. Petersohn, GSAF; Local6.com; Daytona Beach News-Journal . 4/21/2003, p.1C"
2003.04.20.a,20-Apr-03,2003,Unprovoked,USA,Florida,"New Smyrna Beach, Volusia County",Surfing,M,18,Left ankle bitten or right foot,N,14h20,Unidentified species,"S. Petersohn, GSAF; Local 6 News; S. Frederick, Daytona Beach News Journal, 4/28/2003, p.1C; Orlando Sentinel, 4/22/2003, p.B3"
2003.04.19,19-Apr-03,2003,Unprovoked,USA,Florida,"New Smyrna Beach, Volusia County  ",Jumping,M,11,Left foot bitten,N,13h20,A �small� shark,"S. Petersohn, GSAF; S. Frederick, Daytona Beach News Journal, 4/21/2003, p.1C; J. Waymer, Florida Today (Melbourne), 4/19/2003"
2003.04.18,18-Apr-03,2003,Unprovoked,USA,Florida,"North Beach, Patrick AFB, Brevard County",Surfing,M,12,2 lacerations on left thigh,N,08h50,Unidentified species,"Local 6 News; Tallahassee Democrat (FL) 4/19/2003; J. Waymer, Florida Today (Melbourne), 4/19/2003 "
2003.04.15,15-Apr-03,2003,Unprovoked,USA,Florida,"Cocoa Beach, Brevard County",Swimming (using a float),M,20,Left calf lacerated,N,13h00,"15 cm to 20 cm [6"" to 8""] bite diameter just below left knee","Florida Today (Melbourne), 4/16/2003; Orlando Sentinel, 4/16/2003, p.B3"
2003.04.09,09-Apr-03,2003,Unprovoked,USA,Florida,"Melbourne Beach, Brevard County",Surfing,M,,Arm lacerated,N,Dusk,,D. Share
2003.04.04,04-Apr-03,2003,Unprovoked,USA,Florida,"New Smyrna Beach, Volusia County",Surfing,M,50,Left hand and wrist bitten,N,08h00,4' to 5' shark,"S. Petersohn, GSAF"
2003.03.10,10-Mar-03,2003,Provoked,USA,Florida,"Petting Tank, Florida Aquarium, Tampa, Hillsborough County",Petting captive sharks,F,,Hand nipped PROVOKED INCIDENT,N,,60 cm [2'] captive shark,"Florida Aquarium; Miami Herald, 3/13/2002 "
2003.02.15.b,15-Feb-03,2003,Unprovoked,AUSTRALIA,South Australia,"Goolwa Beach, Fleurieu Peninsula",Wading,M,37,Ankle lacerated,N,Dusk,"""a small shark""","T. Peake, GSAF, surfsouthoz.com, 3/38/2003"
2003.02.15.a,15-Feb-03,2003,Unprovoked,USA,Florida,"Jupiter, Palm Beach County",Swimming,M,54,Left hand bitten,N,12h10,Species unidentified,"J. Eager, scubaradio.com"
2003.02.11,11-Feb-03,2003,Unprovoked,AUSTRALIA,New South Wales,"Coogee Bay, near Sydney",Swimming,M,24,"Puncture wounds on heel, legs and buttocks",N,--,Thought to involve a 2 m [6.75'] grey nurse shark,"T. Peake, GSAF"
2003.02.08,08-Feb-03,2003,Unprovoked,AUSTRALIA,Queensland,Burleigh Lake on the Gold Coast,Swimming,M,84,FATAL,Y,Morning,Thought to involve a >2 m [6.75'] bull shark,"T. Peake, GSAF; Sunday Territorian, 2/9/2003, p.9"
