Case Number,Date,Year,Type,Country,Area,Location,Activity,Sex,Age,Injury,Fatal (Y/N),Time,Species,Investigator or Source
1987.06.13,13-Jun-87,1987,Provoked,USA,Florida,"Nest Key, Monroe County",Fishing,M,,Left hand bitten by shark he was dragging ashore by its head PROVOKED INCIDENT,N,Afternoon,1.5 m [5'] blacktip shark,"Miami Herald, 6/14/1987"
1987.05.25,25-May-87,1987,Unprovoked,USA,South Carolina,"Myrtle Beach, Horry County",,M,12,"6"" cut to thigh",N,,1.5 m to 1.8 m [5' to 6'] shark,"Charlotte Observer, 5/28/1987 "
1987.05.08,08-May-87,1987,Unprovoked,USA,Florida,"St Augustine, St. Johns County",Surfing,M,,Hand lacerated  ,N,,,"Orlando Sentinel, 5/10/1987"
1987.05.06,06-May-87,1987,Provoked,AUSTRALIA,New South Wales,,Fishing,M,34,3 fingers severed by metal trace as he tried to haul in a hooked shark. PROVOKED ACCIDENT,N,,,"Courier Mail, 5/7/1987"
1987.04.19,19-Apr-87,1987,Invalid,SOUTH AFRICA,KwaZulu-Natal,Port Shepstone,Fishing,M,,"Slipped off rocks & was treading water when he disappeared, body mutilated by shark/s",Y,,,"G. Charter, R. B. Wilson, G. Cliff, NSB"
1987.04.15,15-Apr-87,1987,Unprovoked,USA,Hawaii,"Kailua-Kona, Hawai'i",Swimming from shore to anchored sailboat,M,,"Presumed FATAL Disappeared, his shark-bitten swim trunks were found on the seafloor",Y,,,"J. Borg, p.76; L. Taylor (1993), pp.106-107"
1987.03.30.b,30-Mar-87,1987,Unprovoked,AUSTRALIA,Western Australia,Fourth Beach / Twilgth Beach,Surfing,M,18,Calf lacerated,N,,"Bronze whaler shark, 2 m to 3 m ","Courier-Mail, 4/2/1987, p.1; T. Peake, GSAF"
1987.03.30.a,30-Mar-87,1987,Provoked,SOUTH AFRICA,Western Cape Province,Muizenberg,,,,"No injury to occupants, boat holed by hooked shark PROVOKED INCIDENT",N,,3 m white shark,"T. Wallett; M. Levine, GSAF"
1987.02.28,28-Feb-87,1987,Unprovoked,USA,Florida,"Singer Island, Riviera Beach, Palm Beach County",Windsurfing,M,,"Lacerations to toe, heel & ankle of right foot",N,,Spinner shark,"Sun Sentinel.�Fort Lauderdale,�3/2/1987,�p.�4B"
1987.01.28,28-Jan-87,1987,Unprovoked,SOUTH AFRICA,Eastern Cape Province,Eerste River,Spearfishing,M,30,Puncture wounds to right hand,N,12h00,>2.5 m [8.25'] white shark,"T. Botha, M. Levine, GSAF"
1987.01.06,06-Jan-87,1987,Unprovoked,AUSTRALIA,Queensland,Lizard Island,Swimming,M,37,Right leg lacerated,N,07h00,,"Sydney Morning Herald; Courier-Mail 1/8/1987, p.2"
1986.12.31,31-Dec-86,1986,Unprovoked,SOUTH AFRICA,Western Cape Province,Agulhas Banks,Spearfishing,M,,2 punctures in lower leg,N,14h00,"Raggedtooth shark, 2.5 m [8.25'] ","P. deWet, E. Lombard, M. Levine, GSAF"
1986.12.22,22-Dec-86,1986,Unprovoked,SOUTH AFRICA,Western Cape Province,SAOU Strand,Body boarding,M,21,"FATAL, legs bitten ",Y,17h00,3 m [10'] white shark,"G. Geldenhuys, W. Roos, Dr. Smallberger, Dr. C. Groble, Dr. J.H. B. de Lange, M. Levine, GSAF; R. Wilson, NSB                                "
1986.12.11,11-Dec-86,1986,Unprovoked,USA,Florida,"Ponce Inlet, New Smyrna Beach, Volusia County",Surfing,M,40,Forearm bitten,N,14h00,1.8 m to 2.1 m [6' to 7'] spinner or blacktip shark,"Orlando Sentinel, 12/12/1986, p.A1"
1986.12.06.a,06-Dec-86,1986,Unprovoked,USA,California,"Monastery Beach, Carmel River State Park, Monterey Peninsula, Monterey California",Free diving  & spearfishing (submerged),M,27,"Punctured lung, lacerations to shoulder, face, jaw, neck & forearm",N,10h00,5 m to 6 m [16.5' to 20'] white shark,"R. Collier, pp.98-99; Atlanta Journal-Constitution, 12/7/1986"
1986.12.04,04-Dec-86,1986,Invalid,SOUTH AFRICA,Western Cape Province,Platbank,Spearfishing,M,22,"No injury, no attack, shark made threat displays",N,,1.8 m [6'] copper shark,"R. O'Connor, M. Levine, GSAF"
1986.11.30,30-Nov-86,1986,Unprovoked,USA,Florida,"Daytona Beach, Volusia County",Surfing,M,17,5' gash in leg,N,10h30,,"Orlando Sentinel, 11/30/1986"
1986.11.19,19-Nov-86,1986,Unprovoked,USA,Florida,"Indiatlantic, Brevard County",Surfing,M,26,Laceration to dorsum of left foot,N,10h40,,"E. Pace, FSAF"
1986.11.04,04-Nov-86,1986,Unprovoked,USA,Florida,"Tiger Shores Beach, Martin County",Surfing,M,23,Ankle bitten,N,,,"Miami Herald, 11/5/1986"
1986.10.17,17-Oct-86,1986,Provoked,SOUTH AFRICA,KwaZulu-Natal,Umhlanga,NSB Meshing,M,,Minor lacerations & puncture wounds to right leg from netted shark taken onboard skiboat PROVOKED INCIDENT,N,,"Raggedtooth shark, 1.96 m, 140-kg ","K. Ndlazi, R. Gardiner, NSB; M. Levine, GSAF"
1986.10.03,03-Oct-86,1986,Unprovoked,USA,Florida,"Sanibel Island, Lee County",Swimming,F,6,Hip & thigh bitten,N,18h00,"Lemon shark, 1.8 m to 2.4 m [6' to 8'], tooth fragment recovered","E. Pace; C. Call; Orlando Sentinel, 10/6/1986, 10/11/1986  & 4/20, 1988"
1986.10.05,05-Oct-86,1986,Unprovoked,SOUTH AFRICA,KwaZulu-Natal,St. Michaels,Racing ski,M,32,"No injury, ski bitten",N,11h00,1.6 m shark,"J. Spiers, M. Levine, GSAF; R. Dugmore, G. Cliff, NSB"
1986.10.01,01-Oct-86,1986,Unprovoked,AUSTRALIA,Western Australia,"Direction Island, Cocos Islands",,,,No details,UNKNOWN,,,"T. Peake, GSAF"
1986.10.00,Oct-86,1986,Unprovoked,USA,Florida,"Floridana Beach, Brevard County",Surfing,M,28,Laceration to right arm,N,,Bull shark,"R.D. Weeks, GSAF; E. Pace, FSAF "
1986.09.22.R,Reported 22-Sep-1986 ,1986,Invalid,USA,Florida,"Pinellas Point, Tampa Bay",,,,Human hand recovered from shark's stomach,N,,1.5 m [5'] blacktip shark,"Orlando Sentinel, 9/22/1986"
1986.09.00.b,Sep-86,1986,Unprovoked,USA,Florida,"Ormond Beach / Daytona Beach, Volusia County",Surfing,,,Survived,N,,,Orlando Sentinel. 9/20/1986
1986.09.00.a,Sep-86,1986,Unprovoked,USA,Florida,"Ponce Inlet, New Smyrna Beach, Volusia County",Surfing,,18,Hand bitten,N,,,Orlando Sentinel. 9/20/1986
1986.08.10,10-Aug-86,1986,Invalid,SOUTH AFRICA,Western Cape Province,Reef on seaward side of Geyser Island,Spearfishing,M,35,"No injury, shark made threat display & impaled itself on spear ",N,11h30,4 m [13'] white shark,"P. DeBruyn, M. Levine, GSAF"
1986.08.03,03-Aug-86,1986,Unprovoked,AUSTRALIA,New South Wales,"North Head, Sydney Harbour",Scuba diving,F,,Survived,N,,Wobbegong shark,Australian Shark Attack File
1986.07.26,26-Jul-86,1986,Boat,AUSTRALIA,Western Australia,3 km west of Rottnest Island,Fishing,,,"No injury to occupants. Shark bit motor, lifting stern a half-metre out of the water",N,,Tooth fragment of a white shark recovered. Authorities believed shark was 6 m [20']  total length,"A. Sharpe, p.134"
1986.07.09,09-Jul-86,1986,Unprovoked,USA,South Carolina,"Myrtle Beach, Horry County",,M,8,Back of left thigh bitten,N,,1.5 m [5'] shark,"Charlotte Observer, 9/9/1986 & 9/11/1986 "
1986.07.00.a,Jul-86,1986,Unprovoked,SOUTH AFRICA,KwaZulu-Natal,LaMercy,Spearfishing,M,26,Minor lacerations on left hand,N,17h15,1.2 m [4'] dusky shark,"L. Gerricke, M. Levine, GSAF  "
1986.05.18,18-May-86,1986,Unprovoked,AUSTRALIA,New South Wales,"North Head, Sydney Harbour",Scuba diving,M,,Survived,N,,Wobbegong shark,Australian Shark Attack File
1986.04.20,20-Apr-86,1986,Unprovoked,USA,Hawaii,"Kaliiwi, Kauai","Fishing, fell from rocks & disappeared",M,,Pieces of clothing & human flesh recovered by Fire Department divers who encountered a large shark,Y,,,"J. Borg, p.76"
1986.03.15,15-Mar-86,1986,Unprovoked,SOUTH AFRICA,KwaZulu-Natal,"North Beach, Durban",Treading water,M,26,Foot bitten,N,16h15,>1 m shark,"A. Bouwer, M. Levine, GSAF;  E. Kerns, NSB"
1986.03.05,05-Mar-86,1986,Unprovoked,SOUTH AFRICA,Eastern Cape Province,"The Fence, King's Beach, Port Elizabeth",Surfing,M,23,"No injury, board struck by shark",N,,2 m [6.75'] shark,"Eastern Province Herald, 3/6/1986"
1986.02.18,18-Feb-86,1986,Unprovoked,SOUTH AFRICA,Eastern Cape Province,East London,Surfing,M,21,"No injury, board bitten",N,12h00,>2.4 m [8'] white shark,"S. Carcary, M. Levine, GSAF"
1986.02.17,17-Feb-86,1986,Unprovoked,SOUTH AFRICA,Eastern Cape Province,Cape Recife,Surfing,M,,"No injury, knocked off board",N,18h00,,"J. Fick, M. Levine, GSAF; Eastern Province Herald, 2/18/1986"
1986.02.07,07-Feb-86,1986,Unprovoked,SOUTH AFRICA,Eastern Cape Province,"King's Beach, Port Elizabeth",Swimming,M,46,Lower leg lacerated,N,18h30,Raggedtooth shark,"J. Fourie, M. Levine, GSAF; V. Cockroft, Dr. P. Schwartz"
1986.02.06,06-Feb-86,1986,Unprovoked,SOUTH AFRICA,Western Cape Province,Arniston,Spearfishing,M,29,2 punctures in upper arm,N,13h30,"Raggedtooth shark, 2 m [6.75'] ","M. Taljaard, M. Levine, GSAF"
1986.01.12,12-Jan-86,1986,Unprovoked,USA,Florida,"Singer Island, Riviera Beach, Palm Beach County",Surfing,M,22,Puncture wounds to both feet,N,08h35,Blacktip shark,"E. Pace, FSAF"
1986.00.00,1986,1986,Unprovoked,USA,California,"Linda Mar Beach, Pedro Point, San Mateo County",Surfing,M,16,"No injury, foot bumped",N,13h00,1.5 m [5'] shark,R. Collier
1985.12.22,22-Dec-85,1985,Unprovoked,SOUTH AFRICA,KwaZulu-Natal,Garvies Beach,Surfing,M,,"Both surfers boards were bumped by sharks, Moolman sustained abrasions on his arm and leg",N,,,"M. Levine, GSAF"
1985.11.11,11-Nov-85,1985,Provoked,AUSTRALIA,Queensland,Gladstone,Fishing,M,,Laceration to lower left leg by hooked shark PROVOKED INCIDENT,N,Afternoon,1m shark,"Courier Mail, 11/13/1985"
1985.11.05,05-Nov-85,1985,Boat,USA,California,"Southeast Farallon Island, Farallon Islands",Boat,,,2 semi-circular bites on aft starboard tube of boat,N,,5.2 to 5.8 m white shark,"R. Collier, pp.178-179"
1985.11.03,03-Nov-85,1985,Provoked,USA,California,5 miles south of Redondo Beach,Fishing,M,24,Forearm bitten by hooked shark PROVOKED INCIDENT,N,,,"Los Angles Times, 11/5/1985"
1985.10.24,24-Oct-85,1985,Unprovoked,SOUTH AFRICA,Eastern Cape Province,East London,Body boarding,M,22,"Left leg severely lacerated, superficial lacerations of right leg,  board damaged",N,08h00,2.5 m [8.25'] white shark,"P. Gee, Dr. K. A. Watt, M. Levine, GSAF; G. Cliff, NSB"
1985.10.22,22-Oct-85,1985,Unprovoked,USA,California,"Point Conception, Santa Barbara County",Hookah diving for abalone,M,46,Minor injury to foot & ankle,N,16h00,2 m to 2.5 m [6.75'  to 8.25'] sixgill or sevengill shark,R. Collier
1985.10.18,18-Oct-85,1985,Unprovoked,USA,Hawaii,"Little Glass Shacks, Princeville, Kaua'i",Body boarding,M,33,"Right hand and part of forearm severed , left hand lacerated, right anterior side of board removed by shark",N,,"Thought to involve a Tiger shark,  3.7 m [12'] ","Syracuse Journal-Herald, 10/21/1985; J. Borg, p.76; G. Ambrose, pp.1-10; L. Taylor (1993), pp.106-107"
1985.10.12,12-Oct-85,1985,Unprovoked,USA,Hawaii,"Barbers Point, O'ahu",Floating on inner tube after diving for lobster,M,24,Left arm lacerated,N,,1.8 m to 2.4 m [6' to 8'] shark,"J. Borg, p.76; L. Taylor (1993), pp.106-107; Orlando Sentinel, 10/14/1985, p.A6"
1985.09.28,28-Sep-85,1985,Unprovoked,USA,California,"Elephant Rock near Tomales Point, Marin County",Free diving & spearfishing (descending),M,,"Hip bumped by shark, no Injury",N,,4 m to 5 m [13' to 16.5'] white shark,"J. McCosker & R.N. Lea; R. Collier, p.97"
1985.09.08.b,08-Sep-85,1985,Invalid,SOUTH AFRICA,KwaZulu-Natal,T.O. Strand,Swimming,M,21,Probable drowning / scavenging,Y,,,"G. Charter,  D. Groger, NSB"
1985.09.08.a,08-Sep-85,1985,Unprovoked,USA,Florida,"Palm Beach, Palm Beach County",Scuba diving,M,,Laceration and 4 puncture wounds to left hand,N,15h00,1.8 m silky shark,M. Vorenburg
1985.09.05,05-Sep-85,1985,Invalid,USA,Florida,"Fort Pierce Inlet, St Lucie County",Swimming,M,17,Found to be a hoax,N,Afternoon,,"Orlando Sentinel, 9/7/1985 ; Miami Herald, 9/7/1985 "
1985.08.22,22-Aug-85,1985,Unprovoked,USA,South Carolina,"Palmetto Dunes, Hilton Head, Beaufort County",Wading,M,87,Right calf bitten & less serious injury to left foot,N,,,"Sumter Daily Item, 8/23/1985"
1985.08.20,20-Aug-85,1985,Invalid,USA,Florida,"New Smyrna Beach, Volusia County",Wading,M,11,"3"" wound on thigh",N,13h00,Shark involvement not confirmed,"Orlando Sentinel, 8/21//1985, p. D.2"
1985.08.17,17-Aug-85,1985,Invalid,USA,Florida,"Bayport, Hernando County",Scuba diving,M,67,Body not recovered. 3 days later some of his equipment was found on seabed appeared damaged by a shark ,Y,10h30,Shark involvement prior to death not confirmed,"E. Pace, GSAF; J. McAniff, NUADC;  Orlando Sentinel, 12/6/1985; K Duffy, Daytona Beach News Journal, 8/26/2001"
1985.07.25.b,25-Jul-85,1985,Unprovoked,USA,Florida,"Daytona Beach, Volusia County",Wading,F,13,Right calf bitten,N,17h00,Possibly a small hammerhead shark,"M. McKee,Orlando Sentinel, 7/30/1985, p.A1"
1985.07.25.a,25-Jul-85,1985,Unprovoked,USA,Florida,"New Smyrna Beach, Volusia County",Surfing,M,15,Hand bitten,N,10h22,,"M. McKee,Orlando Sentinel, 7/30/1985"
1985.07.21,21-Jul-85,1985,Boat,USA,California,"Off Shelter Cover (between Fort Bragg & Eureka), Humboldt County",Bottom fishing for lingcod & had hooked a fish,,,"No injury to occupant, shark rammed boat catapulting it out of the water",N,,5 m to 6 m [16.5' to 20'] white shark,"R. Collier, p.172"
1985.07.19,19-Jul-85,1985,Unprovoked,USA,South Carolina,"Folly Beach, Charleston County",Playing in knee-deep water,F,10,2/3rd of left calf removed,N,,"Tiger shark, 2.4 m to 2.7 m [8' to 9'] ","Atlanta Journal-Constitution, 7/22&23/1985 "
1985.05.26,26-May-85,1985,Unprovoked,USA,California,"Long Beach, Los Angeles County","Surfing, but lying prone on his board",M,,Leg injured,N,,Shark involvement not confirmed,"R. Collier, p.86"
1985.05.08,08-May-85,1985,Provoked,SOUTH AFRICA,KwaZulu-Natal,Umdhloti,Spearfishing,M,39,"After diver shot shark attempting to take his catch, shark bit right arm & tore wetsuit  PROVOKED INCIDENT",N,,30-kg [66-lb] shark,"M. Levine, GSAF"
1985.03.16,16-Mar-85,1985,Unprovoked,USA,Florida,"Palm Beach, Palm Beach County",Surfing,M,25,Hand bitten,N,,,"E. Pace, FSAF"
1985.03.03,03-Mar-85,1985,Unprovoked,AUSTRALIA,South Australia,"Wiseman�s Beach, Peake Bay, Port Lincoln",Free diving for scallops,F,33,FATAL,Y,12h30,6 m [20'] white shark,"A. MacCormick, pp.76-79; H. Edwards, p.155; A. Sharpe, pp.126-127; J. West, ASAF"
1985.02.18,18-Feb-85,1985,Unprovoked,USA,California,"San Miguel Island, Santa Barbara County",Scuba Diving for lobster (at surface),M,29,Bruised,N,12h45,6 m [20'] white shark,"R. Collier, pp.95-96"
1985.02.03,03-Feb-85,1985,Unprovoked,USA,Florida,"15 miles north of Sebastian Inlet, Brevard County",Surfing,M,16,Right foot bitten,N,Afternoon,,"Miami Herald, 2/4/1985, p.6"
1985.01.27,27-Jan-85,1985,Unprovoked,SOUTH AFRICA,Western Cape Province,Struisbaai,Swimming,M,15,"Right knee, calf and ankle lacerated",N,18h30,Raggedtooth shark,"M. Botha, M. Levine, GSAF"
1985.01.18,18-Jan-85,1985,Invalid,SOUTH AFRICA,KwaZulu-Natal,Umzimkulu,,M,,Probable drowning / scavenging,Y,,,"G. Cliff, NSB"
1985.01.17,17-Jan-85,1985,Unprovoked,SOUTH AFRICA,KwaZulu-Natal,Umbogintwini,Surfing,M,18,Thigh & calf bitten,N,18h30,"3.5 m white shark, tooth fragments recovered","B. Eldridge, M. Levine, GSAF; G. Charter & B. Davis, NSB"
1985.01.04,04-Jan-85,1985,Unprovoked,SOUTH AFRICA,Western Cape Province,"Buffels Bay, False Bay",Spearfishing,M,34,Minor injury to torso,N,11h30,3.5 m [11.5'] white shark,"D. James, M. Levine, GSAF; G. Cliff, NSB"
1985.01.00.a,Jan-85,1985,Provoked,SOUTH AFRICA,KwaZulu-Natal,Salt Rock,Spearfishing,M,20,Upper right arm bitten after he shot the shark PROVOKED INCIDENT,N,11h00,1.5 m [5'] dusky shark,"B. Coppin, M. Levine, GSAF"
1984.11.30,30-Nov-84,1984,Unprovoked,AUSTRALIA,Queensland,1 km off Black's Beach,Sailing on catamaran & fell into the water,M,16,FATAL,Y,12h33,"Tiger shark, 4 m ","Courier-Mail, 12/1/1984, p.1; A. Sharpe, p.106"
1984.11.11,11-Nov-84,1984,Unprovoked,USA,Florida,"Jupiter Island Beach, Martin County",Surfing,M,13,Left foot bitten,N,,1.2 m [4'] shark,"Miami Herald, 11/18/1984"
1984.11.04,04-Nov-84,1984,Provoked,USA,Florida,"Fowey Rock, Key Biscayne",Spearfishing,M,29,"Speared shark bit diver's right knee, and lacerated right thigh & buttocks PROVOKED INCIDENT",N,,"""a small shark""","Miami Herald, 11/5/1984"
1984.10.21.b,21-Oct-84,1984,Invalid,USA,Florida,"Wabasso Beach, Indian River County",Swimming,M,22,"Disappeared, 1 mile from where Sandra Fletcher was bitten. Death was due to drowning",Y,14h00,,"Evening Independent, 10/24/1984, p.14;      E. Pace, FSAF"
1984.10.21,21-Oct-84,1984,Unprovoked,USA,Florida,"3 miles south of Sebastian Inlet State Park, Indian River County",Surfing or body surfing,F,23,"9"" laceration to right forearm ",N,13h30,1.5 m [5'] shark,"Miami Herald, 10/24/1984, p.17A"
1984.10.17,17-Oct-84,1984,Invalid,USA,Florida,"Boynton Beach, Palm Beach County",Wading,F,77,"10"" laceration on leg",N,12h05,Shark involvement not confirmed; officials considered barracua,"Miami Herald, 10/18/1984, "
1984.10.14.a,14-Oct-84,1984,Unprovoked,USA,Florida,"Bob Graham Beach, Martin County",Surfing,M,15,Left calf bitten,N,15h00,1.2 m [4'] blacktip shark,"Miami Herald, 10/16/1984"
1984.09.30.a,30-Sep-84,1984,Unprovoked,USA,California,"Tomales Point, Marin County","Free diving , but surfacing",M,,Legs & buttocks bitten,N,10h00,3 m to 4 m [10' to 13']  white shark,"R. Collier, pp.93-94"
1984.09.23,23-Sep-84,1984,Unprovoked,USA,Florida,Volusia County,Surfing,M,17,Right foot bitten,N,14h00,,"Miami Herald, 9/26/1984, p.2D"
1984.09.22.b,22-Sep-84,1984,Unprovoked,USA,Florida,,Swimming,M,Elderly,Left foot lacerated,N,,,"Miami Herald, 9/26/1984, p.2D"
1984.09.22.a,22-Sep-84,1984,Unprovoked,USA,Florida,"Indiatlantic, Brevard County",Surfing,M,16,Foot bitten,N,Morning,Hammerhead shark?+O2356,"Miami Herald, 9/26/1984, p.2D"
1984.09.19,19-Sep-84,1984,Unprovoked,USA,Florida,Volusia County,Swimming,,,No details,UNKNOWN,,,"Miami Herald, 9/26/1984, p.2D"
1984.09.17,17-Sep-84,1984,Unprovoked,USA,California,"Mission Beach, San Diego County",Wading,M,,Arm bitten,N,15h30,small blue shark,"R. Collier, p.93 "
1984.09.15,15-Sep-84,1984,Unprovoked,USA,California,"Pigeon Point, San Mateo County",Skindiving,M,28,FATAL,Y,08h30,4.5 m to 5 m white shark,"R. Collier, p. 72"
1984.08.24,24-Aug-84,1984,Invalid,USA,Florida,"Off Crystal River, Citrus County",Boat capsized?,F,31,Death was due to drowning; body scavenged by a shark,Y,,Tiger shark,"St. Petersburg Times, 11/20/1984"
1984.07.22,22-Jul-84,1984,Invalid,SOUTH AFRICA,Western Cape Province,Cape Point,Spearfishing,M,21,"FATAL, but shark involvement prior to death could not be determined",Y,11h00,,"P. Landsberg, M.D."
1984.07.01,01-Jul-84,1984,Unprovoked,USA,Florida,,"During a shark fishing tournament, the 18' Boatem was capsized by waves, throwing 3 men into the water ",M,30,Leg abraded,N,18h00,,"New Orleans Times-Picayune, 3 July 1984; A. MacCormick, p.109-110"
1984.07.00.a,Jul-84,1984,Unprovoked,SOUTH AFRICA,KwaZulu-Natal,Sodwana,Spearfishing,M,,"No injury, shark hit swim fin",N,,Raggedtooth shark ,"R O'Connor, M. Levine, GSAF"
1984.06.15,15-Jun-84,1984,Unprovoked,SOUTH AFRICA,Western Cape Province,"Muizenberg, False Bay",Surfing,M,27,"No injury, board bitten",N,17h30,2.4 m [8'] white shark,"The Argus, 6/16/1984"
1984.06.03.b,03-Jun-84,1984,Unprovoked,USA,Hawaii,"Kane'ohe Bay, O'ahu",Towing her sister on plastic ski board,F,13,Foot bitten,N,17h00,1.2 m to 1.5 m [4' to 5'] hammerhead shark,"J. Borg, p.76; L. Taylor (1993), pp.106-107"
1984.05.31,31-May-84,1984,Unprovoked,SOUTH AFRICA,Western Cape Province,Arniston,Spearfishing,M,28,Swim fin bitten,N,13h30,,"A. Bosman, M. Levine, GSAF"
1984.03.14,14-Mar-84,1984,Unprovoked,SOUTH AFRICA,KwaZulu-Natal,Amanzimtoti,Surfing,M,,"No injury, 8 pressure dings in surboard",N,17h30,,"G. Charter, NSB; M. Levine, GSAF"
1984.03.10,10-Mar-84,1984,Boat,SOUTH AFRICA,Eastern Cape Province,Swartkops River mouth,Rowing,M,,"No injury to occupant, shark seized oar and disappeared with it.",N,,2.5 m [8.25'] shark,"M. Levine, GSAF"
1984.03.01,01-Mar-84,1984,Unprovoked,AUSTRALIA,Western Australia,Coral Bay,,,,No details,UNKNOWN,,,"T. Peake, GSAF"
1984.02.18,18-Feb-84,1984,Provoked,SOUTH AFRICA,Eastern Cape Province,"Paradise Beach, Jeffrey�s Bay",Fishing,M,,Leg lacerated by hooked shark PROVOKED INCIDENT,N,Night,"Raggedtooth shark, 56-kg [123-lb] ","M. Levine, GSAF; Eastern Province Herald, 6/28/1986"
1984.02.17,17-Feb-84,1984,Provoked,SOUTH AFRICA,KwaZulu-Natal,"Shark tank at Oceanographic Research Insitute, Durban",Scuba diving,M,33,Punctures in wetsuit & left arm bruised by captive shark PROVOKED INCIDENT,N,09h00, 1.5 m [5'] dusky shark,"G. Buckland, M. Levine, GSAF"
1984.02.12,12-Feb-84,1984,Invalid,SOUTH AFRICA,Eastern Cape Province,St. George�s Strand,,,,"Human remains recovered, evidence of scavenging by shark/s",Y,,,"G. Charter, NSB"
1984.02.11,11-Feb-84,1984,Unprovoked,AUSTRALIA,Queensland,Derwent Island,Spearfishing,M,27,Hand bitten,N,,1.5 m white-tipped reef shark,"Courier-Mail, 2/14/1984, p.3"
1984.01.05,05-Jan-84,1984,Unprovoked,SOUTH AFRICA,Eastern Cape Province,Port Alfred,Swimming,M,14,Foot bitten,N,09h30,"Raggedtooth shark, 1 m ","R. Tennent, M. Levine, Dr. Dempers & K. Reynolds"
1984.01.04,04-Jan-84,1984,Unprovoked,SOUTH AFRICA,KwaZulu-Natal,Umlaas Canal,,F,14,Remains recovered 1-4-1984 showed evidence of defense wounds,Y,,,"G. Charter, B. Davis & G. Cliff, NSB"
1984.00.00.b,1984,1984,Provoked,USA,California,San Francisco,Steinhart Aquarium,M,,Head mouthed by captive shark PROVOKED INCIDENT,N,,Sevengill shark,D.C. Reed
1984.00.00.a,1984,1984,Unprovoked,USA,Florida,"Indiatlantic, Brevard County",Surfing,M,,Right foot bitten,N,,,"M. Vosburgh, Orlando Sentinel, 5/28/1988 "
1983.12.25,25-Dec-83,1983,Unprovoked,USA,Florida,"Riviera Beach, Palm Beach County",Surfing,M,17,Left foot & thigh bitten,N,15h30,,"Palm Beach Post, 12/26/1983   "
1983.12.24,24-Dec-83,1983,Unprovoked,AUSTRALIA,South Australia,"Dangerous Reef, South Neptune Island",Scuba diving for abalone,M,48,Fingers bitten,N,,12' white shark,"T. Peake, GSAF"
1983.12.22,22-Dec-83,1983,Unprovoked,SOUTH AFRICA,Eastern Cape Province,Great Fish River,Swimming,M,16,"Left calf, ankle & foot lacerated",N,12h30,,"C. Biggs, M. Levine, J. Mansfield, Dr. T. Counihan & Dr. Clement"
1983.12.21,21-Dec-83,1983,Unprovoked,SOUTH AFRICA,Eastern Cape Province,Nahoon,Swimming,M,47,Shin lacerated,N,08h15,"Raggedtooth shark, >1 m ","R. Horn, East London Aquarium;  J. Heydenrych, M.Levine, GSAF"
1983.12.07,07-Dec-83,1983,Invalid,SOUTH AFRICA,KwaZulu-Natal,LaMercy,,M,,"Two feet found in shark, postmortem scavenging",N,,"1.74 m, 116-kg Zambesi shark","R.B. Wilson , G. Cliff, B. Davis & G. Charter, NSB"
1983.11.10.R,Reported      10-Nov-1983,1983,Unprovoked,USA,Florida,"Melbourne Beach, Brevard County",Surfing,M,15,Laceration to left foot,N,,Tiger shark,"St. Petersburg Times, 11/10/1983"
1983.11.10,10-Nov-83,1983,Invalid,SOUTH AFRICA,KwaZulu-Natal,Tongaat,Swimming,F,,Probable drowning and scavenging,Y,,,"R. Wilson, G. Cliff, Natal Sharks Board; GSAF"
1983.10.17.a,17-Oct-83,1983,Unprovoked,USA,Florida,"Stuart Beach, Martin County",Surfing,M,16,Puncture marks in leg & surfboard dinged,N,,1.5 m [5'] shark,"Miami Herald, 10/21/1983, p.1C"
1983.10.13,13-Oct-83,1983,Unprovoked,USA,Florida,"Daytona Beach, Volusia County",Wading,M,20,Lacerations to left ankle,N,,4.5' shark,"Daytona Beach Morning Journal, 10/21/1983"
1983.09.04,04-Sep-83,1983,Unprovoked,USA,Florida,"Off Lake Worth, Palm Beach County",Standing,M,15,Abrasions to leg,N,,,"E. Pace, FSAF"
1983.08.20.a,20-Aug-83,1983,Unprovoked,SOUTH AFRICA,Western Cape Province,"Seal Island, False Bay",Spearfishing,M,29,Inner thighs lacerated,N,10h00,5 m [16.5'] white shark,"A. Louw, M. Levine,  GSAF; G. Cliff, NSB"
1983.08.13.b,13-Aug-83,1983,Provoked,USA,Florida,"Riviera Beach, Palm Beach County",Skindiving,M,14,Hand abraded when he grabbed shark's tail PROVOKED INCIDENT,N,,Nurse shark,M. Vorenburg
1983.08.13.a,13-Aug-83,1983,Unprovoked,USA,Florida,"6 miles south of Boca Chica Key, Monroe County ",Diving,F,22,Right leg severely bitten,N,Morning,6' to 8' bull shark,"Miami Herald, 8/14/1983, p.1D "
1983.07.26,26-Jul-83,1983,Sea Disaster,AUSTRALIA,Queensland,"Off Lodestone Reef, Great Barrier Reef, north of Townsville",Swimming from the New Venture ,F,21,"FATAL, shark seized her by the chest and took her underwater ",Y,04h00,"Tiger shark, 5 m [16.5']","H. Edwards, pp. 103-104; A. MacCormick, pp.110-112"
1983.07.25.b,25-Jul-83,1983,Sea Disaster,AUSTRALIA,Queensland,"Off Lodestone Reef, Great Barrier Reef, north of Townsville",Swimming from the New Venture ,M,24,"FATAL, shark bit leg, then dragged him underwater ",Y,Night,"Tiger shark, 5 m [16.5']","H. Edwards, pp. 103-104; A. MacCormick, pp.110-112"
1983.07.25.a,25-Jul-83,1983,Sea Disaster,AUSTRALIA,Queensland,"Off Lodestone Reef, Great Barrier Reef, north of Townsville",14 m prawn trawler New Venture capsized  & sank in heavy seas Three people in the water,M,28,"Left knee bitten, but survived",N,Night,"Tiger shark, 5 m [16.5']","H. Edwards, pp.103-104; A. MacCormick, pp.110-112 "
1983.07.15,15-Jul-83,1983,Unprovoked,SOUTH AFRICA,Eastern Cape Province,"Seal Point, Cape St. Francis",Surfing,M,,Left arm injured by shark's tail as it swam beneath his board,N,,3 m to 4 m [10' to 13'] shark,"M. Levine, GSAF"
1983.07.12.b,12-Jul-83,1983,Unprovoked,USA,Florida,"Caloosahatchee River, Lee County",Windsurfing,F,39,Left ankle nipped (3 punctures wounds),N,Afternoon,3.5' hammerhead shark,"Miami Herald, 7/14/1983, p.12A"
1983.07.05,05-Jul-83,1983,Unprovoked,USA,Florida,"Riviera Beach, Palm Beach County",Floating on air mattress,,17,"No injury, shark bit air mattress, deflating it",N,,,"E.Pace, FSAF"
1983.06.29,29-Jun-83,1983,Unprovoked,USA,Florida,"Off 12th Street, Miami Beach",Swimming,M,42,Left foot bitten,N,11h00,,"Miami Herald, 6/30/1983, "
1983.06.20,20-Jun-83,1983,Unprovoked,USA,Florida,"Cocoa Beach, Brevard County",Surfing & dangling foot in water amid baitfish,M,21,Left foot lacerated,N,16h30,,"Miami Herald, 6/22/1983, p.2B"
1983.05.31,31-May-83,1983,Unprovoked,USA,Florida,"Intracoastal Waterway, Boca Raton, Palm Beach County",Water-skiing,M,21,"Left calf, knee & hands lacerated",N,Dusk,6' shark,"E. Pace; Miami Herald, 6/2/1983, p.10A"
1983.05.24,24-May-83,1983,Unprovoked,USA,Florida," Riviera Beach, Palm Beach County",Surfing,M,15,"Knocked off board by shark, no injury",N,,,"E. Pace, FSAF"
