Case Number,Date,Year,Type,Country,Area,Location,Activity,Sex,Age,Injury,Fatal (Y/N),Time,Species,Investigator or Source
1962.02.15,15-Feb-62,1962,Unprovoked,AUSTRALIA,Queensland,Between Smith�s Rock & Moreton Island,Fishing for snappers & cleaning mullet. Put mullet over side of boat to wash it,M,,Middle finger of right hand lacerated,N,A.M.,3.7 m [12'] shark,"Brisbane Courier Mail, 2/16/1962"
1962.02.07,07-Feb-62,1962,Unprovoked,SOUTH AFRICA,KwaZulu-Natal,Winkelspruit,Swimming,M,22,"FATAL, calf bitten twice",Y,09h00,,"M. Levine, J. D'Aubrey, GSAF; D. Davies, pp.114-116"
1962.02.05,05-Feb-62,1962,Unprovoked,SOUTH AFRICA,KwaZulu-Natal,Winkelspruit,Treading water,M,13,"FATAL, tissue removed from thigh, femoral artery severed ",Y,16h20,"White shark, 3 m ","M. Nielsen, M. Levine, GSAF; D. Davies, p.115"
1962.02.04,04-Feb-62,1962,Unprovoked,AUSTRALIA,Queensland,Greenmount Beach,Swimming,M,35,Shin bitten,N,14h30,60 cm  shark ,"Courier Mail (Brisbane), 2/5/1962"
1962.01.21,21-Jan-62,1962,Provoked,AUSTRALIA,New South Wales,Cronulla,Spearfishing,M,19,Suffered from shock & immersion after being dragged underwater  by speared shark PROVOKED INCIDENT,N,,"Bronze whaler shark,  3m [10'] ","Daily Mirror (Sydney) & Sydney Morning Herald, 1/22/1962 "
1962.01.18,18-Jan-62,1962,Invalid,SOUTH AFRICA,KwaZulu-Natal,Margate,"Fishing, slipped on rocks & fell into sea",M,40,Possible drowning / post mortem scavenging,Y,13h10,Zambesi shark,"D. Davies, p.114; A. Cowan, M. Levine, GSAF"
1962.01.14.c,14-Jan-62,1962,Unprovoked,USA,California,Farallon Islands,Spearfishing / Scuba diving (at surface),M,29,Buttock bitten & major leg wound,N,10h30,"White shark, 4 m [13'] ","D. Miller & R. Collier; R. Collier, pp.34-35; H.D. Baldridge, p.74; Clark, pp.98-99"
1962.01.14.b,14-Jan-62,1962,Provoked,AUSTRALIA,New South Wales,"Long Reef, North Manly",Spearfishing,,,Speared shark bit gunwale of boat as it was being hauled onboard PROVOKED INCIDENT,N,," Grey nurse shark,  3 m [10'] ","Sydney Daily Telegraph, 1/15/1962 "
1962.01.14.a,14-Jan-62,1962,Unprovoked,AUSTRALIA,New South Wales,"Lennox Head, Ballina",Surfing,M,19,Dorsum of foot lacerated & toe severed,N,13h30,"2.1 m [7'] shark, a shark's serrated tooth recovered from toe","The Star (Johannesburg), Daily Telegraph (Sydney), Sydney Morning Herald,  The Examiner (Launceston) 1/15/1962; V.M. Coppleson (1962), p.246; R.D. Weeks, GSAF"
1962.01.11.c,11-Jan-62,1962,Boat,AUSTRALIA,South Australia,Marino,Fishing,,,"No injury to occupant, shark bit propeller & lifted boat several feet",N,,Said to involve a Grey nurse shark 3.7 m [12'] ,"Adelaide News, 1/12/1962"
1962.01.10,10-Jan-62,1962,Boat,AUSTRALIA,South Australia,Ceduna,Fishing for sharks,,,No injury to fisherman Alf Dean & other occupants; shark bit stern of boat,N,,White shark,"Adelaide News, 1/10/1962"
1962.01.08,08-Jan-62,1962,Invalid,AUSTRALIA,New South Wales,Lake Illawarra,Swimming,M,25,"Remains recovered from shark, but shark involvement prior to death unconfirmed",Y,,10' whale,"Canberra Times, 1/11/1962"
1962.01.07.b,07-Jan-62,1962,Provoked,AUSTRALIA,Queensland,Dicky Beach,Rowing,,,"No injury to occupants, shark bit 3"" piece from oar after they accidentally struck the shark PROVOKED INCIDENT",N,,,"Sydney Daily Telegraph, 1/8/1962 "
1962.01.07.a,07-Jan-62,1962,Unprovoked,AUSTRALIA,New South Wales,Sydney,Surfing,,,"No injury, shark bumped board flipping him into the water",N,,,08/01/1962
1962.01.06,06-Jan-62,1962,Boat,SOUTH AFRICA,Western Cape Province,6 km off Groot Brak River,Fishing,,,Shark rammed boat 5 times & holed it,N,,,T. Wallett
1962.01.02,02-Jan-62,1962,Provoked,AUSTRALIA,New South Wales,"Seaspray, near Sale",Fishing,,,"No injury to occupants, hooked shark dragged boat 2 miles PROVOKED INCIDENT",N,,2.7 m [9'] shark,"Sydney Daily Telegraph, 1/3/1962 "
1962.00.00.a,Ca. 1962,1962,Unprovoked,AUSTRALIA,South Australia,Dangerous Reef,Diving,M,,Right leg bitten,N,,,"F. Dennis, p.76"
1961.12.28.c,28-Dec-61,1961,Unprovoked,AUSTRALIA,Queensland,"Lambert's Beach, Mackay",Standing,F,18,"FATAL, right arm severed at shoulder, left hand severed, right thigh bitten & surgically amputated.  Died  day after the attack",Y,16h15,3 m [10'] shark,"V.M. Coppleson (1962), p.246; A. MacCormick, pp.19-21; A. Sharpe, p.101 "
1961.12.28.b,28-Dec-61,1961,Unprovoked,AUSTRALIA,Queensland,"Lambert�s Beach, Mackay",Standing,M,24,"Hand bitten, surgically amputated",N,16h15,3 m [10'] shark,"V.M. Coppleson (1962), p.246; A. MacCormick, pp.19-21; A. Sharpe, p.101"
1961.12.28.a,28-Dec-61,1961,Unprovoked,SOUTH AFRICA,KwaZulu-Natal,Umhlanga Rocks,Treading water,M,18,Lower right leg & ankle bitten,N,16h50,Zambesi shark,"D.  Davies, pp.113-114; D. Davies & J. D'Aubrey; T. McDonnell, M. Levine, GSAF"
1961.12.27,27-Dec-61,1961,Provoked,AUSTRALIA,Western Australia,"North of main swimming area in Waterman's Bay Beach, Perth",Spearfishing,M,23,"No injury, Parker shot the shark when it came close to his nephew, Bill Bradbury (14), then the shark bent his speargun PROVOKED INCIDENT",N,07h00,"Grey nurse shark, 2.4 m [8'] ","The West Australia, 12/28/1961 "
1961.12.19,19-Dec-61,1961,Boat,AUSTRALIA,South Australia,Cowell,"Fishing, hauling in a 5-lb snapper",,,No injury to occupant; shark leapt into boat,N,,2.7 m [9'] shark,"Adelaide Advertiser, 12/20/1961"
1961.12.18.a,18-Dec-61,1961,Unprovoked,AUSTRALIA,Queensland,Noosa Heads,"Surfing, pushing board ashore",M,22,"FATAL, right wrist and hand bitten, left leg severed above knee ",Y,06h15,Next morning a 3 m [10'] shark was caught that had Andrews' leg in its gut,"Natal Daily News, 12/19/1961; Sydney Morning Herald, 12/20/1961; V.M. Coppleson (1962), p.246; H.D. Baldridge, p.172; A. Sharpe, pp.100-101"
1961.10.09,09-Oct-61,1961,Invalid,USA,Florida,"Ocean Ridge, Boca Raton, Palm Beach County",Swimming,M,45,"Skeletonized, but shark involvement may have occurred after death.",Y,,,"H.D. Baldridge, p.162"
1961.10.00.a,Oct-61,1961,Unprovoked,USA,Florida,"Boca Raton, Palm Beach County",,M,45,"FATAL. His body washed ashore, presumed shark attack",Y,,,"V.M. Coppleson (1962), p.249"
1961.09.26,26-Sep-61,1961,Provoked,USA,Florida,"Florida Keys, Monroe County",,M,16,Foot & lower leg abraded and lacerated when he kicked the shark PROVOKED INCIDENT,N,16h30,,H.D.Baldridge (1994) SAF Case #923
1961.09.06,06-Sep-61,1961,Invalid,AUSTRALIA,Western Australia,Broome,Attaching a line at sea,,,Shark involvement prior to death priunconfirmed,Y,,,"Canberra Times, 9/8/1962"
1961.08.20,20-Aug-61,1961,Unprovoked,USA,California,"Portuguese Beach at mouth of Salmon Creek, Sonoma County",Swimming,M,16,"Foot, leg  & groin lacerated",N,09h30 / 15h30,"White shark, 4 m [13'] ","L.A. Times, 8/21/1961; D. Miller & R. Collier; R. Collier, p.33; V.M. Coppleson (1962), p.249; H.D. Baldridge, p.72"
1961.08.16,16-Aug-61,1961,Unprovoked,USA,South Carolina,"Pawley�s Island, Georgetown County",Wading,M,19,"Right arm bitten. Left leg bitten, surgically amputated ",N,08h00,White shark,C.O. Adams
1961.08.02,02-Aug-61,1961,Unprovoked,USA,Hawaii,"Pearl Harbor Channel, O'ahu","Net fishing, picking catch from the net",M,38,Hand bitten,N,17h30,2.4 m [8'] shark,"K. Kato; V.M. Coppleson (1962), p.246"
1961.07.07.b,07-Jul-61,1961,Provoked,AUSTRALIA,Queensland,Cape Moreton,Shark fishing,,,"No injury to occupant, hooked shark bit boat's rudder PROVOKED INCIDENT",N,,"White shark, 5.2 m [17'], 2500-lb ","Brisbane Courier-Mail, 7/10/1961; SAF Case #894"
1961.06.24,24-Jun-61,1961,Unprovoked,USA,Florida,"500 yards from Fowey Rock Light, 9 miles east of Key Biscayne, Miami",Scuba diving & spearfishing ,M,23,"FATAL, arm severed & left side of torso removed ",Y,09h30,,"D. McGee, J. Quillian, W. M. Stephens; V.M. Coppleson (1962), p.249; H.D. Baldridge, p.183"
1961.06.18,18-Jun-61,1961,Unprovoked,USA,Florida,"Jensen Beach, Martin County",Standing,M,25,Lacerations to left leg,N,Afternoon,,"News Tribune, 6/20/1961"
1961.06.06.R,Reported 06-Jun-1961,1961,Boat,USA,Florida,"Ponte Vedra Beach, St. Johns County",Spearfishing on Scuba,M,,"No injury to diver or occupants of the boat, shark butted boat ",N,,Hammerhead shark,"Florida Times-Union, 6/6/1961 "
1961.05.21,21-May-61,1961,Unprovoked,USA,California,"Tomales Point, Marin County",Free diving for abalone,M,20,"No injury, wetsuit bitten",N,08h00 / 09h30,White shark,"D. Miller & R. Collier; R. Collier, pp.32-33 "
1961.05.15,15-May-61,1961,Unprovoked,USA,Florida,"Laguna Beach, Bay County",Walking in chest-deep water,M,52,Middle finger of left hand & right forearm lacerated,N,11h30,"Hammerhead shark, 500-llb ","G.L. Morris; Post Herald (Birmingham, Alabama) 5/18/1961; V.M. Coppleson (1962), p.249"
1961.05.07,07-May-61,1961,Provoked,AUSTRALIA,Western Australia,"Quinn�s Rocks, south of Yanchep",Spearfishing,M,,"No injury, speared shark hit speargun PROVOKED INCIDENT",N,,,"The West Australian (Perth), 5/8/1961 "
1961.04.30,30-Apr-61,1961,Invalid,USA,Florida,Palm Beach County,Splashing ,M,10,Abdomen abraded,N,15h00,Shark involvement not confirmed,H.D.Baldridge (1994) SAF Case #942
1961.04.25,25-Apr-61,1961,Provoked,AUSTRALIA,New South Wales,"Trial Bay, north of Kempsey",Spearfishing,M,,Speared shark bit Davy's ankle &  Pierpont's right leg  PROVOKED INCIDENT,N,12h00,"Wobbegong shark, 1.4 m [4'6""] ","Kempsey Macleay Argus (N.S.W.), 4/27/1961"
1961.04.17,17-Apr-61,1961,Provoked,SOUTH AFRICA,Eastern Cape Province,Port Elizabeth Oceanarium,Diving,M,,Shark bit swimfin after diver kicked shark PROVOKED INCIDENT,N,,"2 m  ""yellow belly"" captive shark. Shark destroyed by aquarium staff next day","G. Ross, M. Levine, GSAF"
1961.04.16.b,16-Apr-61,1961,Unprovoked,USA,Florida,"Fowey Rock Light, Miami",Spearfishing,M,22,Thigh bitten,N,,"Tiger shark, 3 m [10']","W. M. Stephens; H.D. Baldridge, p.166; Clark, p.102 "
1961.04.16.a,16-Apr-61,1961,Provoked,AUSTRALIA,New South Wales,Otford,Spearfishing,M,21,Speared shark bit his foot  PROVOKED INCIDENT,N,,"Wobbegong shark, O. barbatus,  1.8 m [6'], identified by G.P. Whitley","Sydney Morning Herald, 4/17/1961; G. P. Whitley; Perth Daily News, 4/19/1961;  V.M. Coppleson (1962), p.252; H.D. Baldridge, p.165"
1961.04.14,14-Apr-61,1961,Unprovoked,AUSTRALIA,New South Wales,10 miles off Nambucca Heads  onboard trawler,"Checking fish traps, fell into the water",M,40,Tiny cuts & bruises on neck  ,N,Night," ""gummy"" shark (Rhizoprionodon or Loxodon) 1.2 m [4']","G. P. Whiltley citing Sydney Morning Herald, 4/15/1961 & 4/17/1961"
1961.04.00,Apr-61,1961,Provoked,AUSTRALIA,Western Australia,Rottnest Island,Spearfishing,M,,Speared shark bit his arm & seat of pants of diving suit  PROVOKED INCIDENT,N,,"Wobbegong shark, 1.4 m [4.6'] ","Perth Daily News, 4/19/1961"
1961.03.30,30-Mar-61,1961,Unprovoked,AUSTRALIA,South Australia,Glenelg Breakwater,Spearfishing,M,24,"Shark took his entire catch, lacerated his knee and tore his wet suit as it brushed past him",N,,"Bronze whaler shark, 2.4 m [8'] Identified by Clyde Buttery","G.P. Whitley citing Sydney Morning Herald, 4/1/1961; V.M. Coppleson (1962), p.252 "
1961.03.14,14-Mar-61,1961,Provoked,AUSTRALIA,Western Australia,Shark Bay,Fishing from dinghy,F,,Hooked shark hauled on board bit her foot PROVOKED INCIDENT,N,,,"Sydney Daily Telegraph, no date; L. Schultz & M. Malin, p.548"
1961.03.12,12-Mar-61,1961,Unprovoked,AUSTRALIA,South Australia,Aldinga Beach,Spearfishing,M,21,Left leg bitten  & left forearm lacerated,N,14h30,"White shark, 3.7 m [12'] ","V.M. Coppleson (1962), pp.182 & 252; H. Edwards, pp.61-63; H.D. Baldridge, p.56; J. West, ASAF"
1961.03.07,07-Mar-61,1961,Provoked,SOUTH AFRICA,KwaZulu-Natal,St. Lucia,Fishing,M,44,Landed shark in boat bit his left leg  PROVOKED INCIDENT,N,,"Zambesi shark, 4'9""","GSAF; D. Davies, pp.112-113"
1961.02.12,12-Feb-61,1961,Unprovoked,SOUTH AFRICA,Western Cape Province,Sea Point,"Spearfishing, shark grabbed his white t-shirt and towed him ",M,27,Torso bruised & abraded ,N,Late afternoon,1.5 m [5'] shark,"C.D. Benzoin, M. Levine, GSAF; J. D'Aubrey, ORI"
1961.02.01.b,01-Feb-61,1961,Unprovoked,SOUTH AFRICA,Eastern Cape Province,Nahoon,Swimming,M,14,"FATAL, multiple injuries to both legs, feet & left arm  ",Y,14h50,"2.1 m [7'], 90-kg shark","D. Davies & J. D'Aubrey;  D. Davies, pp.122-124; M. Levine, GSAF"
1961.02.01.a,01-Feb-61,1961,Unprovoked,AUSTRALIA,Western Australia,Carnac Island,Collecting crayfish,M,,No injury,N,,"Grey nurse shark, 2.7 m [9'] ","H.D. Baldridge, p.134"
1961.02.00,Feb-61,1961,Invalid,USA,California,"Topanga Canyon Beach, Santa Monica Bay",,M,,Considered a doubtful incident,N,,Shovel-nosed guitarfish,"R. Collier, G.. Helfman"
1961.01.25,25-Jan-61,1961,Boat,SOUTH AFRICA,Western Cape Province,Frikkies Bay,Fishing for kob,,,"No injury to occupants, shark took a gaffed fish they were bringing aboard & hit their boat",N,,4.6 m [15'] shark,"Cape Times, 1/27/1961; SAF Case #945"
1961.01.22,22-Jan-61,1961,Unprovoked,SOUTH AFRICA,KwaZulu-Natal,Amanzimtoti,Swimming,M,15,Left thigh bitten ,N,14h20,White shark,"M. Murphy, M. Levine, GSAF; A.C. Copley; G. D. Campbell;  D. Davies, pp.111-112"
1961.01.15,15-Jan-61,1961,Provoked,AUSTRALIA,New South Wales,Cook Island,Collecting aquarium specimens,M,27,Right calf  bitten by lassoed shark on deck of surf ski PROVOKED INCIDENT,N,Morning,"Wobbegong shark, 1.5 m [5'] ","Mackay Daily Mercury (Queensland), 1/16/196; H.D. Baldridge, p.134"
1961.01.06.c,06-Jan-61,1961,Unprovoked,SOUTH AFRICA,KwaZulu-Natal,Winkelspruit,Standing,M,13,"Right foot, leg and hand bitten",N,19h35,"White shark, based on bite pattern","GSAF;  D. Davies & J. D'Aubrey; D. Davies, pp.109-111"
1961.01.03.b,03-Jan-61,1961,Unprovoked,SOUTH AFRICA,Western Cape Province,Strandfontein,Standing,M,25 or 28,"Lower left leg bitten, abrasions on back of right leg",N,15h30,,"Cape Times, 1/4/1961, M. Levine, GSAF"
1961.01.03.a,03-Jan-61,1961,Invalid,SOUTH AFRICA,KwaZulu-Natal,Palm Beach,,,,Human remains (patella & remnants of black swim suit) found in shark,Y,,"Raggedtooth shark, 147-kg [324-lb] ","D. Davies; M. Levine, GSAF"
1961.00.00.e,1961,1961,Boat,AUSTRALIA,New South Wales,South coast,Fishing for mackerel,,,"No injury to occupant, shark took hooked fish then bit stern of boat",N,,,"Brisbane Courier Mail, 12/30/1961 "
1961.00.00.a,1961,1961,Sea Disaster,USA,Hawaii,Maui,Light aircraft ditched at sea,,,3 of the 4 passengers killed by sharks,Y,,,"F. Dennis, p.20"
1960.12.27.b,27-Dec-60,1960,Unprovoked,USA,Hawaii,"Maile Point, O'ahu",Swept out to sea while net fishing,M,,"FATAL  Shark seen attacking Riley, body recovered off Nanakuli",Y,,,"L. Taylor (1993), pp.100-101"
1960.12.27.a.,27-Dec-60,1960,Unprovoked,AUSTRALIA,New South Wales,"Bondi Beach, Sydney",,F,27,"Shark brushed past, minor injuries if any",N,,3 m [10'] shark,"Baltimore Sun, 12/28/1960; Sydney Morning Herald 12/28/1960; V.M. Coppleson (1962), p.246; J. Green, p.35"
1960.12.24,24-Dec-60,1960,Unprovoked,SOUTH AFRICA,KwaZulu-Natal,Margate,Swimming,M,25,"FATAL, legs severed ",Y,16h30,"White shark, 3 m [10'], tooth fragment from wounds identified as that of a white shark","D. Davies & J. D'Aubrey; D. Davies, pp. 108-109; T. Wallett; M. Levine, GSAF"
1960.12.20,20-Dec-60,1960,Unprovoked,AUSTRALIA,Queensland,"College�s Crossing, 54 miles above mouth of the Brisbane River","Fishing, when line became snagged on rock & he dived into water to free it ",M,33,Left thigh lacerated,N,09h00,"Grey nurse shark, 1m ","Sydney Morning Herald, 12/21/1960; V.M. Coppleson (1962), p.246 "
1960.12.01,01-Dec-60,1960,Unprovoked,AUSTRALIA,Queensland,"Colledge's Crossing, Brisbane River",Fishing,M,,Bitten & survived,N,,"Bull shark, 1m ","Sunday Mail, 3/27/1994, p.107"
1960.11.27,27-Nov-60,1960,Unprovoked,AUSTRALIA,Queensland,"Black�s Beach, 9 miles north of Mackay",Swimming,M,41,Right shoulder lacerated,N,14h45,3' shark,"Daily Mercury (Mackay), 11/28/1960 "
1960.11.22,22-Nov-60,1960,Invalid,USA,Florida,"Hutchinson Island Beach, Martin County","Fell overboard, prop slashed arm",F,51,"FATAL, probable drowning & post mortem scavenging",Y,,,"News-Tribune (Fort Pierce, FL], 11/27/1960; SAF Case #803"
1960.11.11,11-Nov-60,1960,Provoked,AUSTRALIA,Queensland,"Scott�s Point, Redcliffe Peninsula",Chasing shark out of bathing area while riding on a surf-ski,M,17,"Shark knocked him off surf-ski, he inhaled water & had to be resuscitated PROVOKED INCIDENT",N,15h00,,"Courier-Mail (Queensland), 11/12/1960; L. Schultz & M. Malin, p.547 "
1960.11.06,06-Nov-60,1960,Unprovoked,AUSTRALIA,Western Australia,Hamelin Bay,"Spearfishing, speared fish retreated to cave where shark grabbed his arm",M,24,Scratches on right upper arm,N,,"Wobbegong shark, 1.8 m [6'] ","The West Australian (Perth), 11/7/1960;   V.M. Coppleson (1962), p.252 "
1960.11.00.d,Nov-60,1960,Boat,SOUTH AFRICA,Western Cape Province,"5 km from Gordon�s Bay, False Bay",Hand lining for shad,,,"No injury to occupants, shark bit 45 cm hole in hull",N,,White shark (tooth fragments recovered from hull of boat),"D. Davies; T. Wallett, p.27-30"
1960.10.25,25-Oct-60,1960,Sea Disaster,USA,California,"Off Point Mugu, Ventura County",Ejected from F3H-2 aircraft ,M,36,"No injury, shark hit his foot & circled",N,14h00,,"US Naval Aviation Safety Center; L. Schultz & M. Malin, p.562"
1960.10.24,24-Oct-60,1960,Boat,SOUTH AFRICA,Western Cape Province,"Jacobs Bay Reef, Saldanha Bay",Fishing for rock lobsters,,,"No injury to occupants, shark rammed & bit  boat",N,,"White shark, 3.7 m to 4.6 m [12' to 15'] "," D. Davies, p.185; Natal Daily News, 10/25/1960; Natal Witness, 10/26/1960"
1960.10.02,01-Oct-60,1960,Invalid,AUSTRALIA,New South Wales,North Head,Fishing,M,24,"Swept off rocks & presumed to have drowned, shark seen in area",N,,Shark involvement not confirmed,"Letter from L. Schultz to G. P. Whitley, dated 2/24/1961"
1960.10.00.c,Oct-60,1960,Invalid,USA,Florida,Haulover Inlet,Diving,M,,"Apparently went missing while diving. Helicopter searching for him spotted school of sharks attacking a ""white object"" 15' below the surface",Y,,,"Miami Herald, 10/18/1960"
1960.10.00.b,Oct-60,1960,Boat,SOUTH AFRICA,Western Cape Province,False Bay,Fishing,,,"Shark rammed boat, breaching its hull",N,,"White shark, 18 mm tooth fragment  recovered from the hull",T. Wallett
1960.09.24,24-Sep-60,1960,Provoked,USA,South Carolina,"Atlantic Beach, Horry County",Fishing inside net,M,,"Multiple superficial lacerations of leg, arm & hand PROVOKED INCIDENT",N,,"2.4 m [8'], 600-lb shark","News (Lancaster, SC), 10/3/1960; H.D. Baldridge, p.142"
1960.09.18,18-Sep-60,1960,Boat,AUSTRALIA,Western Australia,Frenchman Bay,,,,"No injury to occupants, toothmarks on bottom & side of dinghy",N,,3.7 m [12'] shark,P.W. Gilbert
1960.08.10,10-Aug-60,1960,Provoked,USA,Florida,Key Largo Sound,Holding shark on leader & dangling it above the water,M,15,Right hand bitten by hooked shark PROVOKED INCIDENT,N,20h00,"Lemon shark, 1164 mm, immature male, identified by  V.G. Springer",D. Mayo; V. Springer
1960.08.00,Aug-60,1960,Unprovoked,USA,South Carolina,Parris Island,Swimming from camp,M,,FATAL,Y,,,"V.M. Coppleson (1962), p.249"
1960.06.29,29-Jun-60,1960,Provoked,USA,South Carolina,"Little River Beach, Horry County",Surf fishing,M,,"Lacerations to calf, wrist & thumb by hooked shark. PROVOKED INCIDENT",N,14h00,7' shark,"C. Creswell, GSAF; Florence Morning News 6/30/1960"
1960.06.24,24-Jun-60,1960,Unprovoked,USA,Florida,"2 miles east of Dania Beach, Broward County",Scuba diving,M,39,"No injury, shark harrassed diver & attempted to bite his swimfins",N,11h00,"Mako shark, 1.8 m to 2.1 m [6' to 7']  with hook & wire leader caught in mouth",W.F. Fey
1960.06.07,07-Jun-60,1960,Invalid,USA,California,"10 miles off Santa Barbara, Santa Barbara County","Testing classified underwater electronic gear for Raytheon Corporation, vessel torn apart by explosion",M,"37, 67, 35, 27,  ? & 27","Legs & arms bitten, coroner unable to determine if injuries occurred before death.",N,,,"L.A. Times, 6/10/1960; L. Schultz & M. Malin, p.560; SAF Case #724"
1960.05.19,19-May-60,1960,Unprovoked,USA,California,"Aptos, Santa Cruz County",Swimming ,F,16,"Left leg bitten, surgically amputated below the knee",N,13h00,"White shark, 4 m to 5 m [13' to 16.5'] ","D. Miller & R. Collier; R. Collier, pp.31-32; V.M. Coppleson (1962), p.249; H.D. Baldridge, p.71  "
1960.05.16,16-May-60,1960,Provoked,USA,Florida,"Lignum Vitae Channel, Florida Keys, Monroe County",,,,"No injury, harpooned shark bit hull, leaving tooth fragments. PROVOKED INCIDENT",N,,"Lemon shark, 1.8 m [6'] male, N. breviostris, identified by W.A. Stark II, later the same day a 6'8"" pregnant female lemon shark bit the bow of the boat","Randall in Sharks and Survival, p.351  Note: Stark's boat also rammed by shark a lemon shark several years earlier"
1960.04.30,30-Apr-60,1960,Unprovoked,SOUTH AFRICA,KwaZulu-Natal,Amanzimtoti,Treading water,M,16,Multiple major injuries,N,15h35,"White shark, 2.1 m [7']  based on tooth pattern","M. Hely, E. Kerns, M. Levine, GSAF;  G.D. Campbell; D. Davies, pp.102-108; Tim Wallett"
1960.04.24,24-Apr-60,1960,Unprovoked,USA,California,"Tomales Point, Marin County",Skindiving for abalone (but at surface),M,48,Foot & swim fin bitten ,N,14h00,"White shark, 4.9 m [16'] ","F.I. Gilbert; Follett, p. 192-198; D. Miller & R. Collier; R. Collier, pp.30-31; V.M. Coppleson (1962), p.255; H.D. Baldridge, p.71"
1960.04.22,22-Apr-60,1960,Provoked,AUSTRALIA,Western Australia,Rottnest Island,"Fishing, hauling in a set line",M,,4 fingers of left hand were lacerated by shark he had shot in the head PROVOKED INCIDENT,N,,"Bronze whaler shark, 3 m [10'], 200-lb","L. Schultz & M. Malin, p.546"
1960.04.20.R,Reported 20-Apr-1960,1960,Provoked,SOUTH AFRICA,Eastern Cape Province,Port Alfred,Fishing,M,,Gaffed shark bit his ankle PROVOKED INCIDENT,N,,"Raggedtooth shark, 100-lb ","Eastern Province Herald, 4/20/1960"
1960.04.12,12-Apr-60,1960,Unprovoked,AUSTRALIA,New South Wales,"Horseshoe Bay, near Kempsey",Surfing,M,17,Right arm & side bruised,N,Late afternoon,"White shark, 3.7 m [12'] ","Macleay Argus (NSW), 4/14/1960; V.M. Coppleson (1962), p.245"
1960.04.10,10-Apr-60,1960,Provoked,AUSTRALIA,Western Australia,Off Rottnest Island,"Spearfishing, shot a sandtiger shark. Cord to spear tangled round his legs & a wave washed him onto a reef.",M,,"Bruises & minor injuries from reef, not the shark PROVOKED INCIDENT",N,,"Sandtiger shark, 2.1 m [7'] ","V.M. Coppleson (1962), p.252"
1960.04.03.a,03-Apr-60,1960,Unprovoked,AUSTRALIA,New South Wales,Off Broughton Island near Port Stephens,"Speared a grouper, saw shark but it came for him instead of the fish so he fired spear into shark�s mouth. Then shark took grouper but unable to swallow because of the spear in its mouth.",M,,Minor injuries to hand,N,12h00,"Bronze whaler shark, 3.7 m [12'] identified by G.P. Whitley based on description","G. P. Whitley; V.M. Coppleson (1962), p.252"
1960.04.01,01-Apr-60,1960,Provoked,AUSTRALIA,South Australia,Hog Bay,Shark fishing,,,Hooked shark bit stern  PROVOKED INCIDENT,N,,White shark,"The News (Adelaide), 4/1/1960"
1960.04.00.a,Apr-60,1960,Boat,SOUTH AFRICA,Western Cape Province,Saldanha Bay,Fishing,,,Shark rammed boat & bit transom,N,,White shark (tooth fragments recovered),"T. Wallett, p.27"
1960.03.31,31-Mar-60,1960,Unprovoked,USA,Florida,"Off Boca Raton Hotel & Club, Boca Raton, Palm Beach County",Treading water,M,42,"Ankle bitten, hand injured while striking shark",N,12h00,"1.2 m [4'], possibly  larger shark","V.M. Coppleson (1962), p.249, erroneously lists the date as 3/31/1961; H.D. Baldridge, p.142"
1960.02.27.a,27-Feb-60,1960,Invalid,USA,Hawaii,"Between Keawakapu & Makena, Maui",Spearfishing,M,36,Left forearm lacerated,N,08h00,"According to Benjamin, the injury was inflicted by a barracuda, not a shark","Honolulu Star Bulletin, 3/1 /1960; V.M. Coppleson (1962), p.246; J. Borg, p.73; L. Taylor (1993), pp.100-101;  SAF Case #662"
1960.02.10.,10-Feb-60,1960,Provoked,AUSTRALIA,New South Wales,Near Bondi Beach,Shark fishing,,,No injury to occupants. Hooked shark rammed boat  PROVOKED INCIDENT,N,,"Tiger shark, 14' ","Sydney Daily Telegraph, 2/11/1960"
1960.02.07,07-Feb-60,1960,Provoked,AUSTRALIA,New South Wales,Wattamolla National Park,Spearfishing,M,20,"No injury, speared shark towed Gilles 200 yards & tore hole in diving suit, and hit Dowswell's back with its tail PROVOKED INCIDENT",N,,"Grey nurse shark, 2.9 m [9'6""] ",Unidentified press clipping;. SAF Case #203
1960.02.03,03-Feb-60,1960,Invalid,USA,Hawaii,Maui,S2F-1 airplane crashed immediately after carrier take-off,,,"Of crew of 4, only 1 person survived (broken legs but no shark bites). Within 20 minutes of his rescue large sharks were in area. No remains of other 3 crew recovered, and shark involvement in their deaths is questionable. ",Y,02h00,,"L. Schultz & M. Malin, p.562; SAF Case #870 "
1960.01.21,21-Jan-60,1960,Boat,AUSTRALIA,South Australia,Millicent,,,,"No injury to occupants, shark lifted boat",N,,Blue pointer,Hobart Mercury 1/22/1960
1960.01.16,16-Jan-60,1960,Unprovoked,AUSTRALIA,New South Wales,"Just below Roseville Bridge, opposite Killarney picnic reserve, Middle Harbor, Sydney",Free diving,M,13,"FATAL, right leg severed above knee, surgically amputated but died 9 days later ",Y,15h30,Bull shark,"T.W. Brown, pp.1 -6; H.D. Baldridge, p.196; A. Sharpe, pp76-77; H. Edwards, pp.100 & 108"
1960.01.13,13-Jan-60,1960,Provoked,AUSTRALIA,Western Australia,Geraldton,"Fishing, lifting shark out of craypot",M,,Upper leg bitten PROVOKED INCIDENT,N,P.M.,Wobbegong shark,"Western Australian  Perth Daily News, 1/4/1960"
1960.01.01,01-Jan-60,1960,Provoked,SOUTH AFRICA,Western Cape Province,Muizenberg,"Standing, watching seine netters",F,,Left leg bitten by shark that escaped net  PROVOKED INCIDENT,N,,,GSAF
1960.00.00.a,Ca. 1960,1960,Unprovoked,SOUTH AFRICA,Eastern Cape Province,Kei River Mouth,Wading,F,,"Heel lacerated, hand lacerated & abraded",N,11h00,2.1 m [7'] shark,"T. Greig, M. Levine, GSAF"
